dir,precio,col,recamaras,banos,estacionamientos,descripcion,dimensiones,precio_por_mt2,precio_promedio_por_mt2_por_alcaldia,banos_por_habitacion,habitaciones_totales,alcaldia_Azcapotzalco,alcaldia_Benito Juárez,alcaldia_Coyoacán,alcaldia_Cuajimalpa de Morelos,alcaldia_Cuauhtémoc,alcaldia_Gustavo A. Madero,alcaldia_Iztacalco,alcaldia_Iztapalapa,alcaldia_La Magdalena Contreras,alcaldia_Miguel Hidalgo,alcaldia_Tlalpan,alcaldia_Venustiano Carranza,alcaldia_Álvaro Obregón,log_precio
Av Paseo de la Reforma 2693,13950000,Lomas de Bezares,3,3,3,"Departamento en Venta. Ubicado en Av. Paseo de la Reforma, 2693, Lomas de Bezares, Miguel Hidalgo, Ciudad de México, Ver datos, en un desarrollo residencial diseñado por Sordo Madaleno, este espacioso departamento cuenta con 250 m² de superficie. Ofrece 3 recámaras, 3 baños completos, un espacio adaptable como estudio o family room, cocina integrada con sala y comedor, área de lavado, cuarto de servicio, 3 lugares de estacionamiento y una bodega adicional. + Tipo de propiedad: Departamento en venta. + Dirección: Av. Paseo de la Reforma, 2693, Lomas de Bezares, Miguel Hidalgo, Ciudad de México, Ver datos. + Características relevantes: - Superficie: 250 m² - Habitaciones: 3 Recámaras. - Baños: 3 Baños completos. - Con Family o Estudio. - Cocina integral. - Sala y Comedor espaciosos. - Área de Lavado. - Cuarto de Servicio. - Estacionamiento: 3 lugares disponibles. - Bodega disponible. + Normas: - Mascotas Permitidas. - Se permite fumar. Ubicado en un residencial premium con alta seguridad, y cuenta con las siguientes amenidades: + Seguridad alta 24/7 con portero y concierge. + Alberca volada al área libre con carril de nado y climatizada a 28ºC. + Gimnasio completo con baños, vapor, sauna, regaderas y lockers. + Cancha de pádel. + Amplios jardínes con juegos de niños. + Barranca con bosque. + Asador completo con terraza y mesas. + Salón de eventos muy grande. + Salón de adultos con billar, mesa de póker, ping pong, tele. + Segundo jardín de adultos con espejos de agua y jardines bonitos. + Ludoteca grande para niños pequeños. + Estacionamiento de visitas. + Servicio de valet. + Pista de jogging. Vialidades de desagüe: + Av. Constituyentes. + Av Paseo de la Reforma. + Carretera libre Mex-Toluca. + Carretera cuota Mex-Toluca. + Cerca de Santa Fe y de las lomas. Servicios cercanos: + Supermercados, Hospitales y Farmacias, Colegios y universidades, Servicios bancarios, telefonías, Restaurantes, Corporativos y Centros Comerciales con todos los servicios. Esperamos su llamada con mucho gusto!!",250,55800.0,75825.49019607843,1.0,6,False,False,False,False,False,False,False,False,False,True,False,False,False,16.450990137916232
Rio Nazas 31,5300000,Cuauhtémoc,2,2,1,"¡oportunidad única de vivir en una de las colonias mejor planificadas! Gracias A su excelente ubicación, este departamento ofrece una vista agradable Y tranquilidad, ubicado A solo una calle de río rin Y A tres calles de paseo de la reforma. Se encuentra en un edificio interior, con un pequeño balcón para disfrutar del entorno. El departamento consta de 2 recámaras: la principal con baño privado, Y la segunda recámara con closet. Además, cuenta con otro baño completo, así como un lugar de estacionamiento independiente. La ubicación es inmejorable, en una calle sin tráfico, A solo tres cuadras de la bolsa mexicana de valores. Está rodeado de diversos servicios como tiendas, supermercados, restaurantes, lavanderías, tintorerías Y centros comerciales. ¡ideal para quienes buscan comodidad Y acceso A todo lo necesario en su día A día! (rav5768E) (eb-sk7281)",70,75714.28571428571,72589.04109589041,1.0,4,False,False,False,False,True,False,False,False,False,False,False,False,False,15.483217567201578
Secretaria de la Marina 90,11800000,Bosques de las Lomas,3,3,3,"Departamento de 316 mtrs, 3 rec. Cada una con baño, todos los baños acabados en mármol y closet o vestidor, finos acabados, pura duela de madera en todo el departamento, incluyendo recamaras, sala, comedor, estudio y cuenta con oficina independiente o 4ata. Recamara. Cocina en granito, equipo lutron, surround sound por todos lados. Calefacción central. Terraza grande para tener una mesa con asador. La entrada al departamento es de piso de cristal. Excelente vista a las montañas en todo el depto. Muy iluminado y soleado. La renta incluye mantenimiento y puede ser con muebles o sin muebles. 3 lugares de estacionamiento, una bodega. La renta incluye el mantenimiento mensual del condominio. Muy buenas áreas comunes, alberca semi-olímpica, gym con instructor incluido, jardín con juegos, Ludoteca con organizadora, área de jovenes, salón de adultos, cancha de paddle y salón de fiestas. - El precio de venta publicado no incluye: Gastos Notariales, Impuesto de Traslado de Dominio e Inscripción en el Registro Publico de la Propiedad. Sujeto a cambios de disponibilidad sin previo aviso. El mobiliario, electrodomésticos y arte que se muestran en las fotografías, no están incluidos en el costo de venta. Todas las medidas enunciadas son meramente orientativas, las medidas exactas serán las que se expresen en el respectivo título de propiedad de cada inmueble. La publicación de la presente información no representa una oferta pública por lo que toda transacción debe de hacerse de forma personal de acuerdo con las prácticas comerciales de la inmobiliaria y para poder ser valida requiere de la autorización expresa.",316,37341.77215189873,46257.198443579764,1.0,6,False,False,False,True,False,False,False,False,False,False,False,False,False,16.283610174181653
"Filipinas 218, Portales Norte, Benito Juárez",4470000,Portales Norte,2,2,1,"¡Tu nuevo hogar en la colonia Portales Norte te espera! Departamento en preventa con increíble Roof Garden privado. Descubre este departamento de 2 habitaciones y 2 baños completos, con 1 cajón de estacionamiento en una ubicación estratégica de la colonia Portales Norte. Ideal para quienes buscan un hogar moderno, cómodo y con un toque único para disfrutar de momentos especiales. Características: - Roof Garden privado de 26. 21 m², el lugar perfecto para tus fiestas en familia, reuniones con amigos o simplemente para relajarte y disfrutar del aire libre con una vista increíble. - 2 habitaciones diseñadas para brindarte confort y privacidad. - 2 baños completos con acabados de alta calidad. - 1 cajón de estacionamiento para tu conveniencia y comodidad. Situado en una de las zonas más cotizadas de la ciudad, la colonia Portales Norte te ofrece una gran variedad de restaurantes, tiendas, y servicios a tan solo unos pasos. ¡Tendrás todo a tu alcance! Este departamento en preventa es una excelente oportunidad para vivir en un espacio único que combina estilo, comodidad y excelente ubicación. Contáctanos para más información y asegura tu lugar en este increíble proyecto.",98,45612.244897959186,52611.76470588235,1.0,4,False,True,False,False,False,False,False,False,False,False,False,False,False,15.312899190303373
Av Paseo de la Reforma 2693,14000000,Lomas de Bezares,3,3,3,"Departamento en venta - De lujo y familiar. Vive en el lujo y la tranquilidad en este moderno departamento de 250m² en Lomas de Bezares, una de las zonas más ubicadas de la ciudad. Edificio construido por Sordo Madaleno, el departamento cuenta con acabados de alta calidad como piso de madera y cocina integral con barra, este espacio está diseñado para el confort. + Tipo de operación: Departamento en venta. + Ubicación: Av. Paseo de la Reforma 2693, Lomas de Bezares, Miguel Hidalgo, Ver datos Ciudad de México, cdmx. Características: · Metraje: 250m2 habitables. · Recámaras: 3 recámaras amplias, principal con gran vestidor. · Baños: 3 baños completos y medio de visitas. · Cocina integral con barra. · Sala y comedor amplios. · Family grande. · Cuarto de servicio con baño completo. · Área de lavado amplia. · Bodega amplia (+20m²) · 3 estacionamientos. · Piso de madera en recámaras. Normas: + Mascotas: Permitidas. + Se permite fumar en el departamento. Ubicado en un residencial premium con alta seguridad, y cuenta con las siguientes amenidades: + Alberca volada al área libre con carril de nado y climatizada a 28ºC. + Gimnasio completo con baños, vapor, sauna, regaderas y lockers. + Cancha de pádel. + Amplios jardínes con juegos de niños. + Barranca con bosque. + Asador completo con terraza y mesas. + Salón de eventos muy grande. + Salón de adultos con billar, pókar, ping pong, tele. + Segundo jardín de adultos con espejos de agua y jardines bonitos. + Ludoteca grande para niños pequeños. + Estacionamiento de visitas. + Servicio de valet. + Pista de jogging. Vialidades: + Av. Constituyentes. + Av Paseo de la Reforma. + Carretera libre Mex-Toluca. + Carretera cuota Mex-Toluca. + Cerca de Santa Fe y de las lomas. Servicios cercanos: + Centros comerciales con todos los servicios (Arcos, Lilas, Centro comercial Santa Fe, Duraznos, Samara, Park Plaza, Patio Santa Fe, etc) + Supermercados: Superama, sams, Walmart, Chedraui. + Hospitales: abc. + Escuelas y universidades: Ibero, tec, Regina, Cumbres, Irlandés, Vista Hermosa, etc. + Farmacias: San Pablo, Lilas, etc. + Restaurantes, cines y otros servicios recreativos: Clubes deportivos, centros comerciales con miles de opciones. + Corporativos cercanos: Arcos, Santa Fe, Bosques. + Bancos: Citi, hsbc, bbva, Banorte, Santander, etc. + entre muchos otros servicios",250,56000.0,75825.49019607843,1.0,6,False,False,False,False,False,False,False,False,False,True,False,False,False,16.454567959008102
"Coahuila 104roma Sur, Cuauhtémoc",9073410,Roma,2,2,1,"¡Oportunidad única en la Col. Roma! Te presento este exclusivo departamento en preventa, ubicado en una de las zonas más vibrantes y cotizadas de la Ciudad de México, la Colonia Roma. Con 96. 62 m² de espacio habitable, este moderno departamento ofrece lo mejor en diseño y comodidad. Características: -2 habitaciones amplias que te ofrecen privacidad y confort. -2 baños completos, con acabados de lujo y modernos. -Cocina completamente equipada que te permitirán disfrutar de una experiencia única al cocinar. -Balcón de 6. 35 m², perfecto para relajarte y disfrutar de la vista de la ciudad. -Roof garden privado de 75. 84 m², ideal para reuniones, actividades al aire libre o simplemente para relajarte mientras disfrutas del aire libre. -1 cajón de estacionamiento para tu comodidad. Ubicación inmejorable: A solo unos pasos de cafeterías, restaurantes, gimnasios y centros comerciales, y a tan solo 10 minutos caminando del Parque México en la Condesa, lo que te ofrece una excelente calidad de vida y una gran oferta cultural y de entretenimiento. ¡No dejes pasar esta oportunidad de inversión en una de las zonas más exclusivas de la ciudad!",178,50974.213483146064,72589.04109589041,1.0,4,False,False,False,False,True,False,False,False,False,False,False,False,False,16.020858826365288
Saltillo,9500000,Algarín,2,2,2,"Departamento con terraza amueblado en la condesa. 160 m2. 2 recamaras. 2 baños. Sala. Comedor. Terraza. 2 estacionamientos. Amueblado. ** El pago podrá realizarse con recursos propios o con crédito hipotecario de cualquier institución, pública o privada, sujeto a la negociación que lleguen las partes de la compraventa y a las políticas de la institución correspondiente. ** En las operaciones de crédito el costo total se determinará en función de los montos variables de conceptos de crédito y gastos notariales",160,59375.0,72589.04109589041,1.0,4,False,False,False,False,True,False,False,False,False,False,False,False,False,16.066802461833923
"Gabino Barreda, San Rafael, Cuauhtémoc",6080452,San Rafael,2,2,1,"¡Vive el estilo de vida que mereces! Ubicado en una de las zonas más emblemáticas de la ciudad, este moderno departamento de 85 m² habitables con 12 m² de terraza es el espacio perfecto para quienes buscan confort, estilo y excelente ubicación. Con 2 habitaciones, 2 baños completos y un cajón de estacionamiento exclusivo, este departamento ofrece la combinación ideal de amplitud y funcionalidad. Pero eso no es todo: las amenidades comunes te harán disfrutar aún más de tu tiempo en casa: - Sala de juegos para momentos de diversión con familia y amigos- Salón para eventos que se convertirá en el centro de tus celebraciones- Ludoteca y sala de películas, los lugares perfectos para los más pequeños y para noches de cine sin salir de casa- Mesa de ping pong para disfrutar con tus seres queridos- Gimnasio totalmente equipado para tu bienestar físico Vivir aquí te da acceso a lo mejor de la ciudad, con la mejor tranquilidad y un estilo único. ¡Enviame mensaje y conoce el lugar que lo tiene todo!",97,62685.072164948455,72589.04109589041,1.0,4,False,False,False,False,True,False,False,False,False,False,False,False,False,15.62058975774582
COFRE DE PEROTE,23000000,Lomas de Chapultepec,3,3,2,"Increible departamento solo es uno por piso y son 10 departamentos en total, son 3 puertas para entrar, la primera es para entrar a la sala y comedor los cuales son grandes ideales para hacer reuniones, la segunda para entrar a la cocina y la tercera es de servicio. Los acabados son nuevos y de excelente calidadcomo marmoles, granitos y finos pisos, la puerta para entrar a los cuartos es de alta seguridad. Tiene 3 recamaras con baño propio y closet, la principal es muy grande tiene su sala de estar y un closet muy grande donde pueden meter todo lo que quieras, cuentan con un pequeño espacio para poner una oficina, y otro para una sala de tele. Cuenta con dos lugares de estacionamiento. Tiene areas comunes, ludoteca, gimnasio, salon de eventos y alberca. Cuenta con area de servicio muy grande. Excelente lugar para vivir, no pierdas la oportunidad. Aviso de privacidad, así como quejas, sugerencias y más, consulta nuestro sitio oficial o contáctanos para más detalle. No incluye el mobiliario mostrado en las fotografías. El precio es más gastos e impuestos de escrituración.",429,53613.05361305361,75825.49019607843,1.0,6,False,False,False,False,False,False,False,False,False,True,False,False,False,16.951004817371683
Lago Zurich 219,12000000,Polanco,3,2,2,"Muy exclusivo ubicado en Residencial Plaza Carso, Torres Centrales con acceso directo al centro comercial, entrada por City Market, de Lujo, Departamento con una superficie de 125 metros, inmediato a Polanco, Antara, Periférico, Ejercito Nacional, Río San Joaquin, Reforma, Circuito Interior, Lomas de Chapultepec, los mejores Centros Comerciales y Corporativos, Estilo Contemporáneo, precioso departamento excelente orientación, finos acabados en madera, mármol, granito y cerámico, cuenta con amplia estancia, cocina integral con barra de granito abierta, muy iluminado, hermosa vista, 03 recamaras, 02 1/2 baños, 02 estacionamientos, closets empotrados, Cuarto de Lavado y Bodega. Amenidades: Alberca, Gimnasio, salón de fiestas, ludoteca, salón de adultos, jardines con juegos infantiles, Cancha de Paddel. Estricta Vigilancia 24 horas. Cerca de supermercados, cines, las mejores tiendas y restaurantes. Especial para ejecutivos, extranjeros o Recién Casados! Excelente zona, céntrica y con acceso a múltiples servicios, comercios, entretenimiento y vías rápidas, acceso controlado. Excelente ubicación inmediato al restaurantes con acceso a múltiples servicios, comercios y lugares públicos, asi como a una gran oferta cultural, caminando o en auto. Todos los servicios a la mano. A menos de 10 minutos (caminando): cafés, teatros, cines, club deportivo, farmacias, restaurante/bar, bancos, gasolinera, vigilancia, spa, salones y peluquerías, regalos, agencias automotrices, etc. Cerca de Corporativos, las mejores escuelas y Universidades. Una de las zonas con mayor tradición, historia y plusvalía de la Ciudad de México, segura, y con excelentes opciones para pasear y disfrutar con la familia o amigos.",125,96000.0,75825.49019607843,0.6666666666666666,5,False,False,False,False,False,False,False,False,False,True,False,False,False,16.300417291085605
Contadero,4200000,Cuajimalpa,2,2,2,"Increíble departamento con Roof Garden privado. El departamento esta dividido en dos plantas, la primera cuenta con dos recamaras cada una con su baño y en la segunda se encuentra el roof garden, medio baño y el area de lavado. Tiene 2 lugares de estacionemiento, el conjunto tiene jardin, salon de eventos y gimnasio. Ven y conocelo!",160,26250.0,46257.198443579764,1.0,4,False,False,False,True,False,False,False,False,False,False,False,False,False,15.250595321348806
CASA DEL OBRERO MUNDIAL,5116100,Piedad Narvarte,2,2,1,"Moderno departamento ubicado en Casa del Obrero Mundial, Piedad Narvarte, Benito Juárez, cdmx. Entrega en octubre de 2025. A solo dos cuadras de Parque Delta y cerca del metro Centro Médico y Etiopía. Con acceso rápido a Av. Viaducto Miguel Alemán y Vertiz. El departamento cuenta con 80 m2 habitables y 19 m2 de terraza: - 2 recámaras, la principal con vestidor y baño completo, ambas como acceso a terraza. - Sala comedor con acceso a terraza. - Cocina abierta y barra de granito. - Área de lavado. - 1 cajón de estacionamiento. Interesados contactar en día y horario abierto",111,46090.99099099099,52611.76470588235,1.0,4,False,True,False,False,False,False,False,False,False,False,False,False,False,15.447903183471926
EJE CENTRAL,4050000,Portales Sur,2,2,1,"Es un extraordinario edificio de tan sólo 28 departamentos, distribuidos en 8 niveles, de los cuales dos han sido destinados a estacionamientos. Cada departamento cuenta con un balcón doble y ha sido diseñado para que tu experiencia de hogar esté completa. El departamento de 63 m2 habitables más 7 m2 de balcones: - Sala comedor de buen tamaño con acceso a balcón. - 2 recámaras, la principal con baño completo y balcón. - Cocina abierta con barra de granito. - 2 baños completos con cancel de cristal templado. - 1 cajón de estacionamiento. El edificio cuenta con vigilancia 24 horas, elevador y roof garden común muy amplio. Interesados contactar en día y horario abierto.",70,57857.142857142855,52611.76470588235,1.0,4,False,True,False,False,False,False,False,False,False,False,False,False,False,15.214227685996272
BLVD. PASEO DE LA REFORMA,16500000,El Yaqui,3,3,3,"Vivir en este departamento no es solo un privilegio, es una experiencia que redefine el lujo y la comodidad. Ubicado en el corazón de Santa Fe, dentro de un exclusivo desarrollo de los renombrados constructores Girault, este hogar de inspiración europea fusiona la arquitectura clásica con la funcionalidad moderna. Desde el primer paso dentro del edificio, el lobby con vigilancia 24/7 te envuelve en un ambiente de sofisticación y seguridad. Las torres, elegantemente separadas por jardines y áreas boscosas, garantizan privacidad y una conexión única con la naturaleza sin renunciar a la exclusividad urbana. Al cruzar la puerta del departamento, los techos altos con molduras detalladas y los pisos de tzalam natural con respiraderos te transportan a una atmósfera de calidez y refinamiento. Cada espacio ha sido diseñado para ofrecer amplitud, elegancia y funcionalidad en perfecta armonía. La gran cocina es el sueño de cualquier amante de la gastronomía: amplia, luminosa y equipada para que cocinar sea un placer, no una tarea. Su diseño permite organizar cada elemento sin esfuerzo, manteniendo el orden y la estética impecable. Las tres recámaras, cada una con su propio baño y vestidor, ofrecen un santuario privado para cada miembro de la familia. Espacios generosos, acabados exquisitos y una distribución que privilegia la comodidad hacen de cada habitación un refugio personal. Pero el corazón de este departamento es, sin duda, su sala de tv de gran tamaño con acceso a la terraza. Un espacio diseñado para el descanso y la convivencia, donde la luz natural y las vistas crean un ambiente inigualable. El estudio complementa este hogar con un área perfecta para trabajar o simplemente disfrutar de un rincón de tranquilidad. La terraza privada, con vistas despejadas, es el escenario ideal para disfrutar de un café por la mañana o una copa de vino al atardecer. La sensación de libertad y exclusividad se siente en cada rincón de este hogar. Pensado para la funcionalidad sin sacrificar el lujo, el departamento cuenta con un cuarto de lavado y un cuarto de servicio de gran tamaño, proporcionando comodidad absoluta en la organización del día a día. En cuanto a amenidades, este desarrollo lo tiene todo: Alberca y jacuzzi para relajarte sin salir de casa. Gimnasio con equipo de primer nivel. Cancha de pádel para mantenerte activo. Salón de fiestas techado y jardín para eventos, estratégicamente alejados de la torre para garantizar la tranquilidad de tu hogar sin renunciar a la posibilidad de disfrutar de reuniones inolvidables. Además, este departamento incluye tres estacionamientos propios y una bodega, ideal para mantener el orden sin comprometer la estética del espacio. También cuenta con estacionamiento de visitas para recibir a familiares y amigos sin preocupaciones. Este hogar no es solo un espacio para vivir, es un estilo de vida. Un lugar donde el lujo, la tranquilidad y la exclusividad convergen en un equilibrio perfecto. Si buscas lo mejor de Santa Fe en un entorno sofisticado y natural, esta es tu oportunidad. Agenda tu visita y enamórate de cada detalle. Aviso de privacidad, así como quejas, sugerencias y más, contáctanos o visita nuestro sitio web. No incluye el mobiliario mostrado en las fotografías. El precio es más gastos e impuestos de escrituración.",382,43193.71727748691,46257.198443579764,1.0,6,False,False,False,True,False,False,False,False,False,False,False,False,False,16.61887099947687
Av Paseo de la Reforma 2693,13900000,Ampliación Granada,3,3,3,"Departamento en Venta. Ubicado en Av. Paseo de la Reforma, 2693, Lomas de Bezares, Miguel Hidalgo, Ciudad de México, Ver datos, en un desarrollo residencial diseñado por Sordo Madaleno, este espacioso departamento cuenta con 250 m² de superficie. Ofrece 3 recámaras, 3 baños completos, un espacio adaptable como estudio o family room, cocina integrada con sala y comedor, área de lavado, cuarto de servicio, 3 lugares de estacionamiento y una bodega adicional. + Tipo de propiedad: Departamento en venta. + Dirección: Av. Paseo de la Reforma, 2693, Lomas de Bezares, Miguel Hidalgo, Ciudad de México, Ver datos. + Características relevantes: - Superficie: 250 m² - Habitaciones: 3 Recámaras. - Baños: 3 Baños completos. - Con Family o Estudio. - Cocina integral. - Sala y Comedor espaciosos. - Área de Lavado. - Cuarto de Servicio. - Estacionamiento: 3 lugares disponibles. - Bodega disponible. + Normas: - Mascotas Permitidas. - Se permite fumar. Ubicado en un residencial premium con alta seguridad, y cuenta con las siguientes amenidades: + Seguridad alta 24/7 con portero y concierge. + Alberca volada al área libre con carril de nado y climatizada a 28ºC. + Gimnasio completo con baños, vapor, sauna, regaderas y lockers. + Cancha de pádel. + Amplios jardínes con juegos de niños. + Barranca con bosque. + Asador completo con terraza y mesas. + Salón de eventos muy grande. + Salón de adultos con billar, mesa de póker, ping pong, tele. + Segundo jardín de adultos con espejos de agua y jardines bonitos. + Ludoteca grande para niños pequeños. + Estacionamiento de visitas. + Servicio de valet. + Pista de jogging. Vialidades de desagüe: + Av. Constituyentes. + Av Paseo de la Reforma. + Carretera libre Mex-Toluca. + Carretera cuota Mex-Toluca. + Cerca de Santa Fe y de las lomas. Servicios cercanos: + Supermercados, Hospitales y Farmacias, Colegios y universidades, Servicios bancarios, telefonías, Restaurantes, Corporativos y Centros Comerciales con todos los servicios. Esperamos su llamada con mucho gusto!!",250,55600.0,75825.49019607843,1.0,6,False,False,False,False,False,False,False,False,False,True,False,False,False,16.447399470043365
Edgar Alla Poe,33000000,Polanco,3,3,3,"Excelente Departamento, con muy buena ubicación. Tiene 268. 85 m2 Habitables + 110. 92 m2 de Terrazas. 3 Rec. 3, 5 baños. C servicio con baño. 3 terrazas. pbg. 3 autos, se estorba uno del otro. Bodega, área comun. Edad: 5 años. El Edificio tiene solo 6 Departamentos. Tiene Seguridad 24 horas, Roof Garden. Mantenimiento $ 8, 600. ** El pago podrá realizarse con recursos propios o con crédito hipotecario de cualquier institución, pública o privada, sujeto a la negociación que lleguen las partes de la compraventa y a las políticas de la institución correspondiente. ** En las operaciones de crédito el costo total se determinará en función de los montos variables de conceptos de crédito y gastos notariales.",379,87071.2401055409,75825.49019607843,1.0,6,False,False,False,False,False,False,False,False,False,True,False,False,False,17.312018149733785
