dir,precio,col,recamaras,banos,estacionamientos,descripcion,dimensiones,precio_por_mt2,precio_promedio_por_mt2_por_alcaldia,banos_por_habitacion,habitaciones_totales,alcaldia_Azcapotzalco,alcaldia_Benito Juárez,alcaldia_Coyoacán,alcaldia_Cuajimalpa de Morelos,alcaldia_Cuauhtémoc,alcaldia_Gustavo A. Madero,alcaldia_Iztacalco,alcaldia_Iztapalapa,alcaldia_La Magdalena Contreras,alcaldia_Miguel Hidalgo,alcaldia_Tlalpan,alcaldia_Venustiano Carranza,alcaldia_Álvaro Obregón,log_precio
Lago Andromaco 1,6740000,Ampliación Granada,2,2,2,"Vive en un desarrollo donde todo es exclusividad, y en el cual vas a estar totalmente seguro. Ya que el desarrollo fue construido con los más altos estándares de calidad. El Departamento cuenta con: - 86. 43 m2 Habitables. - 2. 40 m2 de Balcón. - 2 Recamaras. - 2 Baños. - 2 Cajones de estacionamiento (Independientes) El desarrollo se encuentra a una cuadras de centros comerciales como Antara Fashion Hall y Plaza Carso con una amplia gama de oferta socio-comercial como restaurantes, cines, museos, experiencias gourmet y gastronomía de primer nivel, así como una vida nocturna con bares y espacios sociales trendy. De igual forma la zona del Nuevo Polanco ofrece una vida familiar con los mejores colegios de la ciudad y con actividades que solo en Polanco puedes encontrar. ¡No lo pienses más y ven a conocer tu nuevo departamento!",89,75730.33707865169,75825.49019607843,1.0,4,False,False,False,False,False,False,False,False,False,True,False,False,False,15.72357063125643
C. Bajio Col. Roma Sur,5299000,Roma Sur,2,1,2,"Estrena departamento en una de las zonas más trend de la cdmx, la Roma Sur. Urban Bajío es un proyecto arquitectónico único en la zona, sus acabados premium y distribución lo convierten en la opción ideal para cubrir todas tus necesidades de vivienda. Edificio de solo 27 departamentos con las siguientes amenidades: *Lobby. *Elevador. *Seguridad 24/7. *Terraza Común, *Áreas Verdes. *Asador. Con 2 recámaras, 2 baños, 1 cajón de estacionamiento. Desde 73m2",73,72589.04109589041,72589.04109589041,0.5,3,False,False,False,False,True,False,False,False,False,False,False,False,False,15.483028870189733
Av. Toluca 669,5100000,Olivar de los Padres,2,2,2,"Exclusivo departamento con acabados de lujo, cuenta con dos recamaras, sala, comedor, cocina, dos baños, area de lavado integrado al departamento, dos terrazas, dos lugares de estacionamiento el departamento se encuentra en planta baja, cuenta con elevador, seguridad 24 horas con circuito cerrado, area de juegos para niños, salon de eventos, alberca, gimnasio, salon de adultos, areas verdes, a solo 5 mintuos de Anillo Periferico.",100,51000.0,50173.010380622836,1.0,4,False,False,False,False,False,False,False,False,False,False,False,False,True,15.444751293772967
"La Morena 763, Narvarte Poniente, Benito Juárez",8340000,Narvarte Poniente,2,2,1,"Un departamento único, para una vida única. ¡Ven a conocerlo! Ubicado en una de las zonas más céntricas de la ciudad, este espectacular departamento de 121 m² habitables y 29 m² de terraza es perfecto para ti. Con 2 habitaciones y 2 baños completos, este lugar está diseñado para brindarte la mejor comodidad. Características: -121 m2 habitables- 29 m2 de terraza- 2 habitaciones- 2 baños completos- 1 cajón de E. La Col. Narvarte es reconocida por su vida de barrio, ideal tanto para jóvenes como para familias. Su ubicación geográfica es privilegiada, ya que se encuentra rodeada de importantes colonias como Del Valle, Roma Sur y Narvarte Oriente, lo que la convierte en un punto estratégico para disfrutar de una vida cosmopolita, bien comunicada y con todo a tu alcance. Solo queda un departamento en planta baja disponible, ¡y puede ser tuyo! Agenda tu cita y conózcalo hoy mismo.",150,55600.0,52611.76470588235,1.0,4,False,True,False,False,False,False,False,False,False,False,False,False,False,15.936573894238999
Blvd. Adolfo López Mateos al 1000,4978313,San Pedro de los Pinos,2,2,1,"Pgh, mggpara quienes gustan de la exclusividad y privilegios, Depto Tipo B2, Ubicación 03, de 92. 43 m2, cuenta con Estancia Comedor, Terraza de estancia a Recamara, Cocina Integral, 2 Recámaras, la principal con vestidor, 2 Baños Completos, Cuarto de Lavado, 1 estacionamiento independiente, evitando las complicaciones de coordinarse con los vecinos. De este tipo, se tienen opción en los pisos: Piso 8 $4&#39;978, 313Piso 9 $4&#39;988, 460Piso 13 $4&#39;979, 413Piso 14 $5&#39;017, 718Piso 15 $5&#39;030, 789Piso 16 $5&#39;143, 660Ubicado en el Complejo Residencial U Place; Proyecto de 2 Torres con 36 niveles, 30 niveles habitacionales, 5 niveles de Amenidades y 9 niveles de estacionamiento, Pet Friendly, cuenta con vigilancia las 24 hrs, Zona de espera para camión escolar, Recepción, Lobby, Elevador, Estacionamiento para visitas, Estacionamiento de bicicletas, Bodegas. increibles amenities en las que podrás vivir experiencias únicas: Alberca con Chapoteadero y Jacuzzi, Sauna/Vapor, Salón de Eventos, Sky Garden Terrace, Ludoteca, Salón de Juegos, Coworking Zone, Estética Canina, Gimnasio, Áreas Verdes, Zona de Asadores, CineSe encuentra en el Centro - Poniente de la cdmx, con acceso a extraordinarias vías de comunicación como Periferico, Eje 5 San Antonio, muy cercano a Av Revolución y Patriotismo, lo que hace muy eficiente la movilidad hacia cualquier punto de la Ciudad, Cercano al centro comercial Plaza Metropoli",92,54112.09782608696,52611.76470588235,1.0,4,False,True,False,False,False,False,False,False,False,False,False,False,False,15.42060183746155
Desierto de los Leones al 6000,21870000,Santa Fe Cuajimalpa,3,3,4,"Increíble departamento en Bosques 6060, es un ph, esta distribuido en dos niveles. La vista es espectacular. Tienes en la primera planta: un recibidor, medio baño de visitas, una terraza enorme con chimenea y vista a la ciudad, en donde te cabe una sala y comedor perfecto para recibir gente. La sala y comedor son muy amplios, además tienes un espacio independiente como family room familiar, que se conecta con la cocina. La cocina es amplia, tiene buena alacena, ventilación natural, cuarto de servicio completo con baño y lavandería. En el piso de arriba, tienes 3 cuartos, cada uno con su vestidor y baño completo, el principal tiene vestidor amplio y doble lavamanos. También tienes un family con una vista padrísima, espacio que puedes poner un family o oficina como área de trabajo. El desarollo tiene un ambiente muy bonito, tienes amenidades para toda la familia, seguridad 24/7, bodega y estacionamientos. El conjunto tiene 4 hectáreas de bosque, cancha de tenis, casa club, gimnasio de primera generación, alberca espectacular, biblioteca, jacuzzis, salón teens, ludoteca, spa, cafetería interna, gimnasio área de pesas, área de Cardio y salón de usos múltiples, cancha de tenis, palapa, cabaña para fiestas",375,58320.0,46257.198443579764,1.0,6,False,False,False,True,False,False,False,False,False,False,False,False,False,16.900626438377685
Av. Revolución 1014,6240878,San José Insurgentes,2,2,1,"Departamento nuevo de Lujo con Espectaculares Vistas a la Ciudad, ubicado en el tercer piso de un edificio exclusivo, con acabados de lujo y una excelente ubicación. Características: - 2 recámaras con closets. - 2 baños de alta calidad. - 3 balcones que rodean el departamento, ofreciendo espectaculares vistas a la ciudad. - 1 estacionamiento independiente. - Excelente ubicación con dos entradas: una por Av. Revolución y otra por la calle Rodrigo Sifuentes. - Acceso seguro y privado. Un Oportunidad Única. Total habitables: 76. 48m2. Balcones: 17. 33m2. Bodega: 2. 65m2. Cisterna 108, 000 lts. No te pierdas la oportunidad de adquirir este departamento de lujo en una de las mejores ubicaciones de la ciudad. Contáctanos para programar una visita y descubrir todos los detalles.",77,81050.36363636363,52611.76470588235,1.0,4,False,True,False,False,False,False,False,False,False,False,False,False,False,15.646631595809628
Rio Nazas 140,8200000,Cuauhtémoc,2,2,1,"Venta de ph exterior con balcón y terraza en Col. Cuauhtemoc, de 2 recámaras, consta de 121M2 Habitables + 27. 68M2 de Roof Garden + 9. 93M2 de 2 Balcones. Se vende para inversión ya que actualmente se encuentra rentado por contrato anual. El Ph se encuentra dividido en 2 departamentos independientes. Departamento 1: Consta de 79m2, balcón de 4. 41 y roof de 27. 68, total 111m2, distribuido en dos pisos, 1 Recamara, la principal cuenta con baño, amplia sala y comedor, cocina abierta, balcón en sala, area de lavado, 1. 5 Baños, 1 lugar de estacionamiento independiente. Departamento 2: Consta de 42. 34 m2mas 5. 52m2 total de 47. 86m2, Una recamara, 1 baño completo, cocina abierta, sala, area de lavado y un balcón. El edificio cuenta con vigilancia 24 Horas.",158,51898.73417721519,72589.04109589041,1.0,4,False,False,False,False,True,False,False,False,False,False,False,False,False,15.919644834185693
"Av. Cuauhtémoc 1193, Letran Valle, Benito Juárez",7127999,Letrán Valle,2,2,1,"¡El departamento que siempre soñaste esta en Letrán Valle! Imagina vivir en un espacio que combina comodidad, ubicación y estilo. Este exclusivo departamento en Letrán Valle es perfecto para quienes buscan calidad de vida en una de las mejores zonas de la ciudad. Características: - 2 habitaciones amplias para tu descanso y privacidad. - 2 baños completos modernos y funcionales. - 1 cajón de E. - Estancia perfecta para relajarte. - Sala/comedor con el espacio ideal para compartir momentos inolvidables. - Cocina equipada, lista para que prepares tus platillos favoritos. - Cuarto de lavado, para mayor comodidad y practicidad. - Terraza espectacular: Disfruta reuniones familiares o fiestas con amigos en un espacio al aire libre único. Excelente ubicación: Vive en el corazón de la ciudad, justo frente a la estación del Metrobús Laurent, con acceso rápido a una gran variedad de restaurantes, centros comerciales, parques y más. ¡Contáctanos hoy mismo y agenda tu visita!",138,51652.166666666664,52611.76470588235,1.0,4,False,True,False,False,False,False,False,False,False,False,False,False,False,15.779541248132782
"Coahuila, Roma, Cuauhtémoc",7986201,Roma,2,2,3,"Este exclusivo departamento te ofrece excelentes espacios en estancia, cocina, baños, recamaras y estacionamientos, acabados y ubicación. Así como un espacioso Roof Garden privado ideal para tus eventos y reuniones. Características: - 2 recamaras- 2 baños completos - 3 estacionamientos- Cocina equipada Amenidades: - Lobby- Vigilancia 24/7 - Elevadores - Roof Garden privado - Gimnasio - Salón de usos múltiples - Ludoteca ¡Envíame un mensaje para conocerlo hoy mismo!",150,53241.34,72589.04109589041,1.0,4,False,False,False,False,True,False,False,False,False,False,False,False,False,15.893225860550373
Lago Neuchatel 10,15000000,Ampliación Granada,3,3,2,"Exclusivo Penthouse de 240 m² en Neuchatel. Este impresionante penthouse de dos niveles cuenta con una sala y comedor de doble altura que se extiende hacia dos amplios balcones, proporcionando vistas inigualables. La cocina es independiente y bien equipada. Dispone de 3 recámaras, cada una con baño privado y excelentes acabados superiores a los de otros departamentos del edificio. El espacio ofrece una cómoda sala familiar, y todos los baños cuentan con ventanas que permiten una excelente ventilación. Los dos cajones de estacionamiento son amplios, independientes y de fácil maniobra. Las áreas comunes incluyen una alberca techada, jacuzzi, vapor, vestidores, gimnasio, business center, cine, salón de eventos, y seguridad las 24 horas, todo diseñado para tu confort y bienestar.",240,62500.0,75825.49019607843,1.0,6,False,False,False,False,False,False,False,False,False,True,False,False,False,16.52356082573315
Bernardo Quintana,17500000,Santa Fe La Loma,3,3,2,"En venta amplio departamento con una vista panorámica y acabados excepcionales. _______________________________________. Aviso de privacidad, así como quejas, sugerencias y más, consulta nuestro sitio oficial o contáctanos para más detalle. No incluye el mobiliario mostrado en las fotografías. El precio es más gastos e impuestos de escrituración.",340,51470.58823529412,50173.010380622836,1.0,6,False,False,False,False,False,False,False,False,False,False,False,False,True,16.677711496036597
AMORES,6140000,Acacias,2,2,2,"Departamento moderno y con acabados de lujo en la col Acacias, cerca del plaza mitika. El departamento cuenta con: -2 recámaras de buen tamaño (la principal con su vestidor y su baño completo) -2 baños completos. -Cocina abierta de buen tamaño. -Estancia comedor. -2 Lugares de de estacionamiento. -Área de lavado. El desarrollo cuenta con las siguientes características: Alberca, Ludoteca para bebés, Business Center, Coffee Break, Coworking, Terraza Lounge, Sala de cine, Sala de juegos, Sport's Bar, Taller - Aula. Área de asadores, Hamacas, Jacuzzi, Sky Bar, Huerto orgánico, Sky Lounge, Área de mascotas, Juegos para niños, Jardín Zen / Picnic. Interesados contactar en día y horario abierto",70,87714.28571428571,52611.76470588235,1.0,4,False,True,False,False,False,False,False,False,False,False,False,False,False,15.63033546298976
"Filadelfia 156, Nápoles",5339701,Nápoles,2,2,1,"¡No pierdas la oportunidad de vivir en la colonia Nápoles! Este hermoso departamento esta perfectamente distribuido, con acabados de excelente calidad, tiene dos recamaras, y un baño completo. caracteristicas: -2 recamaras-2 baño-1 estacionamiento amenidades: -Lobby -Vigilancia 24/7-Elevador ¡Envianos un mensaje para conocerlo hoy mismo! (Los renders e imágenes son ilustrativos y de referencia)",73,73146.5890410959,52611.76470588235,1.0,4,False,True,False,False,False,False,False,False,False,False,False,False,False,15.49068040413576
Cumbres de Santa Fe,22500000,San Mateo Tlaltenango,3,3,4,"Excelente departamento en piso alto con vista abierta y orientación suroriente lo que le da espléndida luz y temperatura en Residencial Santa Fe dentro de Cumbres. Desarrollo con amenidades: Salón eventos, Gym, zona húmeda con canal de nado, jacuzzi, chapoteadero, cancha pádel y jardines. Consta de elevador directo a recibidor, baño visitas, sala doble y comedor -ambos ambientes con salida a terraza con espléndida vista verde, cocina integral, family amplio con salida terraza al igual que recámara principal con baño y vestidor. 2 Recámaras secundarias con baño y vestidor c/u. Área de servicio con 1 habitación con baño y lavandería. 4 Cajones de estacionamiento y 1 bodega. Calefacción. Disponible abril 2025. Se puede visitar.",350,64285.71428571428,46257.198443579764,1.0,6,False,False,False,True,False,False,False,False,False,False,False,False,False,16.929025911619092
MIER Y PESADO,8550000,Del Valle Norte,3,2,2,"Gran desarrollo totalmente nuevo en preventa, que ofrece comodidad y seguridad en una excelente zona de la cdmx. El desarrollo esta distribuido en 3 torres y 4 niveles, 6 departamentos por piso algunos con terrazas y/o balcón, 1 elevador y cajones de estacionamiento totalmente independientes! Super accesible al estar a unos metros de Av. Xola y Obrero Mundial, a unos minutos de Viaducto Miguel Alemán y Av. Cuauhtémoc. El desarrollo esta rodeado de tiendas, bancos, gran variedad de restaurants, cafés, 1 parque y mas. El departamento cuenta con 191 ms2 totales distribuidos en: -Sala comedor conectado a terraza. -Cocina Integral con barra de granito. -Área de lavado con ventilación e iluminación natural. -3 habitaciones. -2 baños y medio. -Espacio para Sala de tv. -47 ms2 de terrazas totales. -2 cajones de estacionamiento independientes. Interesados contactar en día y horario abierto.",191,44764.397905759164,52611.76470588235,0.6666666666666666,5,False,True,False,False,False,False,False,False,False,False,False,False,False,15.961441957872001
"Río Nazas 156, Cuauhtémoc, Cuauhtémoc",6850001,Cuauhtémoc,2,2,1,"Se encuentra a sólo unos pasos del corredor de Reforma, por lo que seguramente tus ratos libres no podrán ser aburridos. Tendrás cientos de comercios de todo tipo a sólo unos pasos, plazas, parques, gimnasios, restaurantes, y mucho más. Caracteristicas: -85 m2 habitables-2 recamaras-2 baños completos-Terraza-1 estacionamiento - Cocinas equipadas con barras de granitoamenidades: -Elevador-Roof garden común -Vigilancia 24/7¡¡Envíanos un mensaje para conocer todo acerca de tu nuevo hogar!!",105,65238.10476190476,72589.04109589041,1.0,4,False,False,False,False,True,False,False,False,False,False,False,False,False,15.739759502209168
"Chicago, Nápoles",8500000,Nápoles,2,2,2,"Ubicado en el corazón de la colonia Nápoles. La distancia a avenida insurgentes es de 3 min. Caminando, caminando a 10 min. Del Parque Hundido, a 15 min. De la estación del metrobus Insurgentes, a 6 minutos caminando del World Trade Center y Pepsi Center vía insurgentes y calle Dakota, a 25 min. De la colonia Condesa, en auto a 5 min. De avenida insurgentes, a 5 min. De Viaducto, a 10 min. De distintos super mercados. La ubicación es inmejorable. características destacadas: Lindo departamento distribuido en 2 niveles: Primer Nivel: Estancia con ventilación natural, vista exterior y techos altos. Cocina abierta. Baño completo que da servicio a área social y segunda recámara. Recámara secundaria con closet, vista interior, ventilación e iluminación natural. Recámara principal con vestidor, vista exterior arbolada, balcón, baño y ventilación e iluminación natural. Segundo Nivel: Área de lavadoEspectacular Roof Garden, con vista panorámica de la ciudad. caracteristicas generales: Edificio de solo 5 niveles5to. Nivel con elevador2 estacionamientos techados y en fila que no se estorban y vigilancia las 24 horas, tu seguridad y la de tu familia están garantizadas. El departamento tiene una fabulosa distribución de los espacios, es el producto ideal para invertir, con una ubicación privilegiada. Llama para que lo conozcas! Para Aviso de Privacidad, quejas, sugerencias o aclaraciones comunícate a los teléfonos de la inmobiliaria o visítanos en Av. Revolución 1564 colonia San Ángel. Los gastos de escrituración, avalúo y gastos por aperturas de crédito no están incluidas, así como el mobiliario, electrodomésticos y arte que se muestran en las fotografías. Para Aviso de Privacidad, quejas, sugerencias o aclaraciones, comunícate a los teléfonos de la inmobiliaria o visítanos en Av. Revolución 1564, colonia San Ángel.",159,53459.11949685535,52611.76470588235,1.0,4,False,True,False,False,False,False,False,False,False,False,False,False,False,15.955576839107596
Iglesia,6500000,Jardines del Pedregal,2,2,2,"En be grand san ángel, piso 9, con excelente iluminación Y distribución, Y además, en excelente estado de conservación. Cuenta con amplia estancia con amplio ventanal, cocina abierta y con alacena, área de lavado (para centro de lavado), recámara principal con baño y vestidor muy amplios, recámara secundaría con closet y comparte baño con área social. Tiene 2 lugares de estacionamiento. El condominio cuenta con alberca techada muy grande, juegos infantiles, gimnasio, salón para adultos, ludoteca, salón de eventos y estricta vigilancia. ¡invierte en tu estilo de vida! *El precio no incluye: impuestos, gastos notariales, derechos, honorarios, costos de tasas de interés y/o gastos en caso de financiamiento; ni mobiliario, ni artículos decorativos, ni electrodomésticos, salvo especificación en contrario*",122,53278.688524590165,50173.010380622836,1.0,4,False,False,False,False,False,False,False,False,False,False,False,False,True,15.687312888712007
Mirador S/N,4800000,Fuentes de Tepepan,3,3,2,"Hermoso departamento en tercer piso, dentro de un magnífico fraccionamiento con excelente ubicación con agradables áreas verdes, cámaras de seguridad, vigilancia las 24 horas del día y excelentes amenidades. Cuenta con dos albercas, una exterior, otra techada y una extra para niños, vestidores, jacuzzi, gimnasio muy bien equipado, lindos jardines con áreas grill, ludoteca, juegos infantiles, salón de juegos con terraza, pista de jogging, área para bicis y patinetas. Estacionamientos techados, súper seguro y agradable para vivir en familia. El departamento se encuentra en excelente estado, muy iluminado con agradable vista. Se compone de 3 recámaras, la principal con baño completo y walk-in closet, segunda recamara con baño completo, estancia, comedor, cocina abierta, área de lavado. 2 estacionamientos y bodega. Agende su cita: Ver datos y Ver datos. Al ""Contactar"" para consultar esta propiedad, estás aceptando los ""Términos y Condiciones"" y ""Aviso de privacidad"". Aviso de Privacidad, Quejas, Sugerencias y más en nuestro sitio oficial. * Los gastos e impuestos de escrituración no están incluidos en el precio de venta, así como el mobiliario, electrodomésticos y arte que se muestran en las fotografías. Las medidas son ilustrativas y deben de corroborarse con los títulos de propiedad respectivos y/o las boletas predial.  Los precios publicados y la disponibilidad pueden cambiar sin previo aviso por lo que se debe de verificar con la inmobiliaria y los propietarios de los inmuebles.",120,40000.0,40000.0,1.0,6,False,False,False,False,False,False,False,False,False,False,True,False,False,15.38412668421143
Av Santa Fe 546,5975000,Santa Fe Cuajimalpa,1,1,1,"Vanguardista departamento de 85 m2 ubicado en Peninsula Tower, entre Av Santa Fe y Paseo de los Arquitectos, de las avenidas mas seguras, con moderna infraestructura y áreas verdes peatonales en la cdmx. Cruzando la calle se encuentra el bello Parque de la Mexicana con canchas deportivas, restaurantes y cafés de moda, y a escasos metros importantes centros comerciales y centros corporativos, prestigiadas escuelas y universidades, el reconocido Hospital abc, etc. La Torre cuenta con fabulosas amenidades: Alberca techada, gran gimnasio con equipo de vanguardia, salón de yoga y meditación, salón de usos múltiples, spa can 3 cabinas de massaje y salón de belleza, sala de cine, business center, roof garden con asadores, barra y jacuzzis, vigilancia 24 hrs. El depto., cuenta con aire acondicionado y calefacción, balcón a todo lo largo con ventanales corredizos de piso a techo para acceder desde la sala como desde la recámara. La distribución es armoniosa, pasillo de acceso con medio baño para visitas, amplia area de sala comedor, cocina abierta con lavavajillas y triturador, area de lavado integrada, recamara con baño privado y closet, 1 cajón de estacionamiento. Llame; sera un gusto atenderle",82,72865.85365853658,46257.198443579764,1.0,2,False,False,False,True,False,False,False,False,False,False,False,False,False,15.60309482314585
"Sadi Carnot, San Rafael, Cuauhtémoc",9499999,San Rafael,3,3,1,"¡Último departamento con roof garden privado de 119. 81 m²! Conoce este excelente departamento de gran amplitud y de buena iluminación, con espacios perfectamente distribuidos y de gran altitud. Este grandioso departamento tiene 3 recamaras donde puedes colocar tu cama king size y tener espacio de sobra para un estudio. El depa cuenta con su propio roof garden privado de 119. 81 m², ideal para tus eventos familiares o fiestas con amigos. Características: - 3 recamaras- 3 baños completos- 1 cajón de E. Independiente- Roof garden privadoAmenidades: - Roof Garden común- Salón de usos múltiples- Elevador- Vigilancia 24/7¡Enviame un mensaje para agendar tu visita!",256,37109.37109375,72589.04109589041,1.0,6,False,False,False,False,True,False,False,False,False,False,False,False,False,16.06680235657077
"Sur 16 101 306, Edif. B , Agrícola Oriental , 08500 Iztacalco, Ciudad de México, México",2380000,Agrícola Oriental,2,1,1,"Ref: 2 3 5 6 4 9. Departamento en venta en Oriente Park 1, ubicado en Agrícola Oriental, Iztacalco, cdmx. Con solo 3 años de antigüedad, este inmueble en el tercer piso de la Torre B ofrece un ambiente moderno y funcional. Cuenta con dos recámaras, un baño, cocina integral y pisos de cerámica en todas las áreas. Dispone de un cajón de estacionamiento en servidumbre y acceso mediante elevador. El conjunto ofrece gimnasio, salón comunal, zona infantil, lavandería y áreas verdes. Seguridad y comodidad en una excelente ubicación. #DepartamentoEnVenta #cdmx #AgrícolaOriental #OrientePark #HogarIdeal #Inmueblescdmx #VentaDePropiedades #OportunidadDeInversión #Seguridadycomodidad #Viviendacdmx #TuNuevoHogar #Inmobiliaria #BienesRaíces. ¡No dejes pasar esta oportunidad de vivir en un lugar único en la Ciudad de México!",58,41034.48275862069,40008.76680303916,0.5,3,False,False,False,False,False,False,True,False,False,False,False,False,False,14.682611465815636
