dir,precio,col,recamaras,banos,estacionamientos,descripcion,dimensiones,precio_por_mt2,precio_promedio_por_mt2_por_alcaldia,banos_por_habitacion,habitaciones_totales,alcaldia_Azcapotzalco,alcaldia_Benito Juárez,alcaldia_Coyoacán,alcaldia_Cuajimalpa de Morelos,alcaldia_Cuauhtémoc,alcaldia_Gustavo A. Madero,alcaldia_Iztacalco,alcaldia_Iztapalapa,alcaldia_La Magdalena Contreras,alcaldia_Miguel Hidalgo,alcaldia_Tlalpan,alcaldia_Venustiano Carranza,alcaldia_Álvaro Obregón,log_precio
Bajío 315,20502990,Roma Sur,3,2,2,"¡Descubre tu nuevo hogar lleno de luz natural y comodidades! Este amplio departamento tiene todo lo que necesitas para vivir cómodamente. Echa un vistazo a sus características destacadas: - Precio: $Ver datos. - Espacioso departamento de 2 niveles con 114m2. - Incluye 2 cajones de estacionamiento para tu comodidad y seguridad. - Con 3 acogedoras recámaras, hay espacio para toda la familia. - Cuenta con 2 baños para mayor comodidad. - Cocina equipada para dar rienda suelta a tu pasión culinaria. Disfruta de una excelente iluminación natural que brinda una sensación de calidez y amplitud. Características del departamento. - 3 Recámaras. - 2. 5 Baños. - 2 Cajones de Estacionamiento. - Departamento de Triple Altura. - Metros cuadrados: 324m2. - Roof Garden Privado: Sí - Precio: $Ver datos. - Piso: 7. ¡Este es el lugar perfecto para crear recuerdos inolvidables! Contáctanos ahora para obtener más información y programar una visita. ¡No pierdas la oportunidad de hacer de este departamento tu nuevo hogar! Amenidades. * Alberca. * Yoga. * Juegos Infantiles. * Áreas verdes. * Jardín de eventos. * Casa Club. * Gimnasio. * Coffee Bar. * Business Center. acabados. * Cocina Equipada. * Área de lavado. * Acabados de lujo (Barras de granito de la más alta calidad) * Mármol en baños y cocinas. * Madera de ingeniería en pisos. ubicación. 1 Hospital Angeles México. 2 Parque Delta. 3 Castillo Chapultepec. 4 Centro Médico. 5 Auditorio Nacional. 6 Museo Arte Moderno. 7 Hospital Angeles Mocel. 8 Zológico Chapultepec. 9 Museo Nacional de Antropologia. 10 El Palacio de Hierro. 11 Museo Tamayo Arte Contemporáneo. 12 Angel de la Independencia. 13 Diana Cazadora. 14 Museo del Objeto. 15 El Plaza Condesa. 16 Cine Tonalá 17 Universidad la Salle. 18 Mercado de Medellin. 19 Museo del Cárcamo de Dolóres",324,63280.833333333336,72589.04109589041,0.6666666666666666,5,False,False,False,False,True,False,False,False,False,False,False,False,False,16.836081335904936
Lago Zurich 219,6200000,Ampliación Granada,1,1,1,"Exclusivo departamento de lujo en Residencial Plaza Carso con excelente orientación, finos acabados en madera, mármol, granito y cerámico, cuenta con amplia estancia, cocina integral con barra de granito abierta, muy iluminado, 70 m2, 1 recamara, 1 baño, 1 estacionamientos, walk in closet. Amenidades: Alberca, Gimnasio, salón de fiestas, ludoteca, salón de adultos, jardines. Estricta Vigilancia 24 horas, inmediato a importantes corporativos como Nestlé, Colgate, Tetra Pack, Philip Morris, Telcel a unas cuadras de Polanco, Lomas de Chapultepec y los mejores Centros Comerciales como Antara y Palacio de Hierro, Zona de Corporativos. Acceso directo a supermercados, City Market, cines, las mejores tiendas y restaurantes. La zona es muy segura, ideal para ejecutivos y expatriados",70,88571.42857142857,75825.49019607843,1.0,2,False,False,False,False,False,False,False,False,False,True,False,False,False,15.64006001130563
Lomas de Vista Hermosa 80,26500000,Cuajimalpa,3,3,4,"Divino departamento en condominio moderno en Lomas de Vistahermosa. Excelentes espacios amplios, vista inigualable y jardín precioso! Tres recámaras cada una con su baño y vestidor con opción a una cuarta. Family, biblioteca o estudio, antecomedor, comedor, sala, cocina, cuarto de servicio completo, área de lavado, baño de visitas. Amplia cocina, alacena, cuarto para vajillas. 4 estacionamientos techados. Bodega amplísima en el mismo piso que el departamento. Elevador directo al departamento. Ventanas de doble vidrio aislante y calefacción de piso. Seguridad 24 hrs. Antigüedad 15 añosMantenimiento $Ver datos mts2 de construcciónÁreas comunes: Cancha de pádel, gimnasio y jardín espectacular. piat convierte a clientes informados y conocedores, en dueños, vendedores e inversionistas exitosos.",416,63701.92307692308,46257.198443579764,1.0,6,False,False,False,True,False,False,False,False,False,False,False,False,False,17.0926553286923
Lago Zurich 272,14500000,Ampliación Granada,3,3,3,"Muy exclusivo ubicado en Residencial Plaza Carso, Hermoso, de Super Lujo, inmediato a Polanco, Antara, Periférico, Ejercito Nacional, Río San Joaquin, Reforma, Circuito Interior, Lomas de Chapultepec, los mejores Centros Comerciales y Corporativos, Estilo Contemporáneo, precioso departamento, excelente orientación, vista panoramica al Museo Soumaya, muy iluminado, lleno de luz, acabados de super lujo, mármol, granito y cerámica, fina carpinteria italiana, cuenta con amplia estancia, cocina integral con barra de granito abierta, muy iluminado, hermosa vista panoramica, 03 recamaras, 03 1/2 baños, Sala de television o estudio, 03 estacionamientos, closets empotrados, Cuarto de Servicio con baño integrado, Cuarto de Lavado. Amenidades: Alberca, Gimnasio, salón de fiestas, ludoteca. Estricta Vigilancia 24 horas. Cerca de supermercados, cines, las mejores tiendas y restaurantes. Excelente zona, céntrica y con acceso a múltiples servicios, comercios, entretenimiento y vías rápidas, acceso controlado. Excelente ubicación inmediato al restaurantes con acceso a múltiples servicios, comercios y lugares públicos, asi como a una gran oferta cultural, caminando o en auto. Todos los servicios a la mano. A menos de 10 minutos (caminando): cafés, teatros, cines, club deportivo, farmacias, restaurante/bar, bancos, gasolinera, vigilancia, spa, salones y peluquerías, regalos, agencias automotrices, etc. Cerca de Corporativos, las mejores escuelas y Universidades. Una de las zonas con mayor tradición, historia y plusvalía de la Ciudad de México, segura, y con excelentes opciones para pasear y disfrutar con la familia o amigos.",170,85294.11764705883,75825.49019607843,1.0,6,False,False,False,False,False,False,False,False,False,True,False,False,False,16.489659276356317
Avenida Santa Fe 462,6800000,Santa Fe Cuajimalpa,1,2,2,"Departamento en venta en avenida Santa Fe con vista al parque La Mexicana. Gran departamento ubicado en una de las mejores zonas de Santa Fe, cerca de restaurantes, supermercados, cafeterías. Gran ubicación con el parque de la mexicana a unos pasos. El departamento cuenta con una recámara con opción a segunda recámara, dos baños completos, cocina abierta, bodega y dos lugares de estacionamientos. Las amenidades de este departamento son de primer nivel: alberca con asoleadero, gimnasio, cancha de pádel, jardines, juegos infantiles, asador, salón de jóvenes.",82,82926.82926829268,46257.198443579764,2.0,3,False,False,False,True,False,False,False,False,False,False,False,False,False,15.732433317205148
Secretaria de la Marina 58,15500000,Bosques de las Lomas,3,3,3,"Gran departamento con vista excepcional, muy soleado, la orientación en sala, comedor y recamara principal es poniente y en las recamaras secundarias oriente. Cuenta con aire acondicionado y calefacción por área, solo no en sala y comedor ya que es muy amplia el área y no se necesita. Sala y comedor con pisos de mármol de placa muy grande con marco de madera y cobre. En sala lambrin de madera con chimenea de alcohol. Comedor con precioso mueble empotrado con gran capacidad de guardado, varias paredes forrada en un marmol espectacular y otras forradas en madera. A la entrada hay un mueble hermoso forrado en madera y cobre que hace juego con el marco del piso. Bar escondido en la sala. El pasillo forrado en mármol y el piso es igual al área social. Baño de visitas oculto en la pared de madera. Super finos acabados y listo para mudarse. La cocina en cuarzo con gran isla, muy ventilada y con preciosa vista, horno y parrilla separada, capacidad de refrigerador y congelador independientes, doble tarja, excelente alacena. Muy buen cuarto de servicio, con capacidad para tres camas, área de lavado, salida de servicio y closet de blancos. Increíble recamara principal, muy espaciosa con ventanal en escuadra, el techo esta forrado en madera, cabe tambien una sala y mesa. El baño completamente en mármol con ventilación natural, doble lavamanos y precioso walk in closet con chapa de clave. El Family Room con sillón, mueble de T. V. Y buena área de trabajo. Closet de blancos y medicinas en esta misma área que es afuera de las recamaras secundarias. Las 2 recamaras de niños, con pisos en madera natural, techos altos. Espacios muy generosos, en una de ellas hay 3 camas matrimoniales, baño con ventilación natural y walk Inn en cada una. Excelente distribución. 2° recamara muy grande, caben 3 camas matrimoniales, baño con ventilación, excelente walk in closet. 3° recamara grande con excelente iluminación. - El precio de venta publicado no incluye: Gastos Notariales, Impuesto de Traslado de Dominio e Inscripción en el Registro Publico de la Propiedad. Sujeto a cambios de disponibilidad sin previo aviso. El mobiliario, electrodomésticos y arte que se muestran en las fotografías, no están incluidos en el costo de venta. Todas las medidas enunciadas son meramente orientativas, las medidas exactas serán las que se expresen en el respectivo título de propiedad de cada inmueble. La publicación de la presente información no representa una oferta pública por lo que toda transacción debe de hacerse de forma personal de acuerdo con las prácticas comerciales de la inmobiliaria y para poder ser valida requiere de la autorización expresa.",321,48286.604361370715,46257.198443579764,1.0,6,False,False,False,True,False,False,False,False,False,False,False,False,False,16.5563506464056
Bosque de Canelos 41,11000000,Bosques de las Lomas,4,3,2,"Se vende Departamento penthouse en edificio pequeño con pocos departamentos en Bosque de Canelos. Muy amplio con doble altura y en buen estado de conservación cuenta con estancia con sala y comedor con vista panorámica, 4 recámaras tres de ellas con vestidor y baño, la cuarta puede ser sala de tv o recamara, terraza que corre a lo largo de 3 recámaras, antecomedor, cocina muy amplia, medio baño de visitas, cuarto de lavado y cuarto de servicio. Áreas comunes; alberca techada, gran jardín y salón de fiestas. Muy buena opción en la zona. Súper precio. - El precio de venta publicado no incluye: Gastos Notariales, Impuesto de Traslado de Dominio e Inscripción en el Registro Publico de la Propiedad. Sujeto a cambios de disponibilidad sin previo aviso. El mobiliario, electrodomésticos y arte que se muestran en las fotografías, no están incluidos en el costo de venta. Todas las medidas enunciadas son meramente orientativas, las medidas exactas serán las que se expresen en el respectivo título de propiedad de cada inmueble. La publicación de la presente información no representa una oferta pública por lo que toda transacción debe de hacerse de forma personal de acuerdo con las prácticas comerciales de la inmobiliaria y para poder ser valida requiere de la autorización expresa.",350,31428.571428571428,46257.198443579764,0.75,7,False,False,False,True,False,False,False,False,False,False,False,False,False,16.213405921671733
Reforma 105,3385000,Juárez,2,1,2,"Ref: 2 3 9 9 9 9. Departamento Pre venta en Paseo de la Reforma Ubicación y Plusvalía Garantizadas. Vive o invierte en una de las zonas más exclusivas de la cdmx. Este moderno departamento en preventa de 37 m² cuenta con terraza privada, cocina equipada, closets y un baño, ideal para quienes buscan confort y estilo. Disfruta de amenidades premium: alberca, gimnasio, salón de usos múltiples, roof garden, restaurante y más. ¡Pet friendly! Ubicado en Col. Juárez, con acceso inmediato a Reforma, Insurgentes y Circuito Interior, a minutos del Centro Histórico y rodeado de restaurantes, tiendas y cultura. Entrega: Diciembre 2028. ¡Asegura tu inversión hoy! Contáctanos para más información.",37,91486.48648648648,72589.04109589041,0.5,3,False,False,False,False,True,False,False,False,False,False,False,False,False,15.034864759749444
VICTOR HUGO,4550000,Portales Norte,2,2,2,"Conoce este increíble desarrollo en preventa ubicado en la Colonia Portales Norte. Cuenta con 20 departamentos divididos en 4 niveles, 2 recámaras, 2 baños y hasta 2 cajones de estacionamiento. Este departamento cuenta con 67 m2 habitables más 71 m2 de roof privado con acceso directo: - Sala comedor con buen iluminación y acceso a roof. - Cocina semiabierta con barra de granito y área de lavado contigua. - 2 recámaras, la principal con vestidor, baño completo y balcón. - 2 baños completos. Además 2 cajones de estacionamiento independientes. Agenda una cita con nosotros para conocer este hermoso desarrollo.",138,32971.014492753624,52611.76470588235,1.0,4,False,True,False,False,False,False,False,False,False,False,False,False,False,15.330638010707329
AVENIDA TOLUCA,3500000,Olivar de los Padres,2,2,2,"Conoce este departamento que puede ser tu hogar o inversión ideal! Este departamento te brinda un diseño actual, con gran entrada de luz natural, cocina abierta que se conecta con la estancia para sala -comedor y desde la cual tendrás acceso a un balcón a todo lo largo que te conecta con el exterior una linda vista a los árbolada. Ideal para decorar con tus plantas favoritas y hacer de este lugar el favorito para disfrutar en una tarde tranquila. Cuenta con dos recámaras con clóstes, persianas para día y noche, la principal con baño completo y un baño más que da servicio a la recámara secundaria y a tus visitas, área de lavado integrada al depto. Ubicado en el segundo piso, con vigilancia 24 hrs, elevador y dos lugares de estacionamiento independientes, uno de ellos techado para que tu auto esté más fresco y mejor cuidado. Además muy cómodo porque no te estorba nadie no hay eleva autos! Ubicado en una zona segura como lo es Olivar de los Padres, a pocos minutos de periférico, a unos pasos de super mercados, colegios como el Senda, Oxford, Edron, club Libanes, en fin aquí podrás resolver de todo en tu misma zona. Entra en jornada notarial! No esperes más y llámanos para agendar una visita y que lo conozcas en persona. Aviso de privacidad, asi como quejas, sugerencias y más, contáctanos o visita nuestro sitio web. El precio es más gastos e impuestos de escrituracion. No incluye el mobiliario mostrado en las fotografías.",75,46666.666666666664,50173.010380622836,1.0,4,False,False,False,False,False,False,False,False,False,False,False,False,True,15.068273812173887
CALZADA DE TLALPAN,3890000,San Simón Ticumac,3,2,2,"Bonito desarrollo totalmente remodelado de 68 departamento en total, con espacios muy amplios, buena distribución y acabados modernos. El desarrollo cuenta con varios tipos de departamentos desde los 60 ms2 hasta los 122 ms2, de 2 a 3 recamaras y algunos con balcon y/o terraza privada. Se encuentra bien ubicado al estar sobre Calzada de Tlalpan, el cual conecta con Avenidas como Eje 7 Emiliano Zapata, Cumbres de Maltrata, Angel Urraza y accesible hacia norte y sur. Cerca de las estaciones de metro Portales y Nativitas, a 5 min caminando de Wal Mart Nativitas, restaurants, tiendas, farmacias, bancos etc. El departamento cuenta con 103 ms2 distribuidos es: -Sala comedor amplia. -Cocina Integral. -Area de Lavado. -3 habitaciones. -2 baños completos. -no se cuenta con espacios de estacionamiento, pero se tiene la opción de pensión a 50 mts del desarrollo. Interesados contactar en dia y horario abierto para conocer los diferentes tipos de departamentos.",103,37766.99029126213,52611.76470588235,0.6666666666666666,5,False,True,False,False,False,False,False,False,False,False,False,False,False,15.173919972664004
GABRIEL MANCERA,5720000,Del Valle Sur,2,2,1,"Conoce Gabriel Mancera un desarrollo ubicado en las mejores zonas de la cdmx, la Colonia del Valle, cerca de la Av Félix Cuevas y Av. Universidad, la zona se caracteriza por un ambiente tranquilo y además es una zona segura, cerca de restaurantes, bares y hospitales. Este desarrollo cuenta con acabados de lujo, cocina integral, closet y cancelería. Amenidades que te encantarán: lobby, elevador, vigilancia y Pet Friendly. Espacios comunes diseñados para la comodidad de las mascotas y dueños. Encuentra el departamento que mejor se adapta a tus necesidades, conoce las características y la variedad de opciones que tiene para ti. Agenda una cita con nosotros para conocer este hermoso desarrollo. Pent house exterior con dos balcones. -2 recamaras 2 Baños. Sala comedor y cocina. 1 cajón de estacionamiento en fila que comparte con otros 2 autos. Vigilancia 24hrs y cámaras de seguridad",114,50175.43859649123,52611.76470588235,1.0,4,False,True,False,False,False,False,False,False,False,False,False,False,False,15.55947953818114
Durango,12474283,Roma Norte,2,2,2,"Departamento con gran terraza en el corazon de la colonia roma norte, alcaldia cuauhtémoc. Descubre Durango, un lugar diseñado para disfrutar cada día al máximo. Ubicado en la cosmopolita colonia Roma Norte, una de las zonas más vibrantes de la Ciudad de México, este proyecto combina una ubicación inmejorable con un estilo de vida exclusivo y un entorno seguro. Vive la privacidad en plena vida urbana, con servicios excepcionales y amenidades que te permitirán crear experiencias inolvidables. Este proyecto boutique cuenta con solo 22 departamentos exclusivos, cada uno con las dimensiones perfectas para la convivencia y el descanso. Diseñados para convertir tu espacio en tu lugar favorito, cada detalle ha sido cuidadosamente pensado para tu comodidad y disfrute. Amenidades: Library Lounge: Un espacio lleno de tranquilidad y confort, ideal para trabajar, colaborar o disfrutar de tu libro favorito. Salón de usos múltiples. Roof Garden: El lugar perfecto para vivir experiencias memorables al aire libre con tus amigos. pj01. 156. 1 m² Totales93. 5 m² Habitables59. 60 m² TerrazaDistribución: Sala y comedor con cocina abiertaÁrea de lavado1 baño completo para la segunda recámara y visitasRecámara principal con vestidor, baño completo y salida a la terrazaSegunda recámara con clóset y acceso a una terraza privada. 2 lugares de estacionamiento. 1 bodega. Vigilancia privada 24/7Vive la exclusividad y el confort en Durango 262, donde cada día se convierte en una experiencia extraordinaria. restricciones: • Las imágenes y renders son ilustrativos y de referencia. • El precio no incluye mobiliario. • Las dimensiones publicadas pueden presentar variaciones mínimas. • Los precios están sujetos a cambios sin previo aviso. • El precio no contempla gastos de escrituración ni costos iniciales asociados a la adquisición mediante crédito hipotecario, como avalúo y comisión por apertura. • Para más información, consulte nuestro Aviso de Privacidad en nuestra página web.",154,81001.83766233767,72589.04109589041,1.0,4,False,False,False,False,True,False,False,False,False,False,False,False,False,16.339179803165134
Rio Tiber,10056700,Cuauhtémoc,2,2,1,"¡listos para estrenar! Edificio de solo 8 departamentos nuevos, totalmente amueblados Y equipados ¡ideales como inversión! Disfruta de lujo, exclusividad y silencio en esta ubicación privilegiada. El edificio cuenta con gimnasio y terraza superior totalmente amueblada para tus momentos de esparcimiento. Con excelentes acabados en cada espacio, estos departamentos también te ofrecen agradables vistas y una magnifica iluminación natural, además de amplitud. Es un departamento por piso con elevador directo, y cuenta con 2 recámaras cada una con baño, estancia con frente muy amplio y salida a gran balcón, medio baño de visitas, cocina con espacio para ante comedor, área de lavado junto a la cocina, y 1 estacionamiento. ¡Son una oportunidad única de inversión! Desde $10, 056, 700 M. N. Equipamiento: Cisterna de agua pluvial, cisterna de agua potable, elevador con clave de acceso, cctv, sistema hidroneumático, calentador eléctrico, estufa eléctrica, secadora eléctrica. Acabados: porcelanato, madera de ingeniería, ventanería duovent, cristal templado en regaderas, cubierta de granito en cocina. *El precio no incluye: impuestos, gastos notariales, derechos, honorarios, costos de tasas de interés y/o gastos en caso de financiamiento; ni mobiliario, ni artículos decorativos, ni electrodomésticos, salvo especificación en contrario*",135,74494.07407407407,72589.04109589041,1.0,4,False,False,False,False,True,False,False,False,False,False,False,False,False,16.123749736448712
Arquimedes 29,19500000,Polanco,3,3,3,"Se renta propiedad en la exclusiva zona de Polanco, ubicada en la Ciudad de México, México. Este inmueble se encuentra en excelente condición y fue construido en el año 2013. Cuenta con una superficie total de 240 metros cuadrados, distribuidos en 3 suites, 3 baños, 1 baño adicional y 3 estacionamientos. Además, esta propiedad ofrece servicios como alberca y gimnasio, ideales para aquellos que buscan un estilo de vida activo y saludable. La ubicación de la propiedad es inmejorable, en la Calle Arquímedes número 29, en el noveno piso. Esta zona es reconocida por su elegancia y exclusividad, lo que la convierte en una excelente opción para vivir. Polanco es conocido por su oferta gastronómica, cultural y de entretenimiento, con una gran variedad de restaurantes, tiendas de lujo y espacios culturales. Además, cuenta con fácil acceso a importantes vías de comunicación y transporte público, lo que facilita la movilidad en la ciudad.",240,81250.0,75825.49019607843,1.0,6,False,False,False,False,False,False,False,False,False,True,False,False,False,16.785925074816024
Bajio,5399900,Roma Sur,2,2,1,"Departamento exclusivo en el corazon de la colonia roma sur, en la alcaldia cuauhtémoc. cuenta con 69M2 habitables mas 7M2 de balcon, con 2 amplias recamaras, 2 baños completos Y 1 cajon de estacionamiento. es un desarrollo de 27 departamentos, cuenta con amenidades como terraza comun, areas verdes Y asador. restricciones: • Las imágenes y renders son ilustrativos y de referencia. • El precio no incluye mobiliario. • Las dimensiones publicadas pueden presentar variaciones mínimas. • Los precios están sujetos a cambios sin previo aviso. • El precio no contempla gastos de escrituración ni costos iniciales asociados a la adquisición mediante crédito hipotecario, como avalúo y comisión por apertura. • Para más información, consulte nuestro Aviso de Privacidad en nuestra página web.",76,71051.31578947368,72589.04109589041,1.0,4,False,False,False,False,True,False,False,False,False,False,False,False,False,15.501891178033112
Av. Secretaria de Marina,17700000,Lomas del Chamizal,3,3,3,"¡Gran oportunidad en Club Residencial Bosques! Torre Cedros. ¡Gran oportunidad en Club Residencial Bosques! Este exclusivo departamento de 275 m² más una espectacular terraza de 75 m² te ofrece una vida de lujo y comodidad en uno de los residenciales más prestigiosos del poniente de la ciudad, con las mejores amenidades. Características del departamento: Tres amplias recámaras, cada una con baño privado y vestidor. Family room perfecto para disfrutar en familia. Área de lavado y cuarto de servicio para mayor comodidad. Tres lugares de estacionamiento exclusivos. El desarrollo: Impresionante arquitectura que fusiona modernidad y funcionalidad. Abundante vegetación y amplias áreas verdes, creando un entorno tranquilo y relajante. Casa club de primer nivel, diseñada para tu bienestar y disfrute. ¡No dejes pasar la oportunidad de vivir en un lugar único! Contáctanos para más detalles o para agendar una cita. ¡Tu nuevo hogar te espera!",275,64363.63636363636,46257.198443579764,1.0,6,False,False,False,True,False,False,False,False,False,False,False,False,False,16.68907525404123
Colima 415,7000000,Roma Norte,3,2,1,"Excelente departamento en una zona privilegiada con faciles accesos, muy céntrico. El departamento se encuentra en el 5 piso, tiene muchísima luz, es calientito, tiene amplios espacios, la recámara principal cuenta con vestidor Y baño, las otras dos recamaras tienen amplios closets con cajoneras Y comparten baño, el segundo baño cuenta con instalación de vapor. Sala comedor de parquet muy amplia, con una vista espectacuar, cuenta con cuarto de servicio Y su baño, el edificio tiene 13 pisos, tiene 2 elevadores, vigilancia 24 horas, el gas es estacionario, cuenta con jaulas de tendido en la azotea. (rav-5758E) (eb-rz2237)",137,51094.890510948906,72589.04109589041,0.6666666666666666,5,False,False,False,False,True,False,False,False,False,False,False,False,False,15.76142084987672
