dir,precio,col,recamaras,banos,estacionamientos,descripcion,dimensiones,precio_por_mt2,precio_promedio_por_mt2_por_alcaldia,banos_por_habitacion,habitaciones_totales,alcaldia_Azcapotzalco,alcaldia_Benito Juárez,alcaldia_Coyoacán,alcaldia_Cuajimalpa de Morelos,alcaldia_Cuauhtémoc,alcaldia_Gustavo A. Madero,alcaldia_Iztacalco,alcaldia_Iztapalapa,alcaldia_La Magdalena Contreras,alcaldia_Miguel Hidalgo,alcaldia_Tlalpan,alcaldia_Venustiano Carranza,alcaldia_Álvaro Obregón,log_precio
Carr. México-Toluca 5804,7500000,Contadero,3,3,2,"Departamento en venta en Be Grand Contadero, edificio de lujo con excelentes áreas comunes, cuenta con 3 habitaciones la principal con baño y vesitdor, 3 baños completos, cuarto de servicio con baño propio y 2 estacionamientos el edificio cuenta con seguridad 24 hrs, estacionamiento de visitas, casa club con alberca, gimnasio, area de asadores, spa, canchas de paddel, sport bar, kids club y áreas verdes, cerca de universidades, hospitales, supermercados",140,53571.42857142857,46257.198443579764,1.0,6,False,False,False,True,False,False,False,False,False,False,False,False,False,15.830413711839864
MIER Y PESADO,9945880,Del Valle Norte,3,3,2,"El desarrollo de Mier y Pesado es un moderno conjunto de 3 torres con 6 departamentos por piso, algunos con Terrazas amplias y/o Balcones, Roof Garden privados y comunes, estacionamientos independientes, elevadores, bodegas, así como roof garden común. El Pent House en 4to nivel, cuenta con: -143 m2 habitables más 17 m2 de balcones. - 66 m2 de roof privado con acceso directo. - Cocina Integral con barra de granito. - Sala comedor amplios con acceso a balcón exterior. - 3 recamaras amplias, dos de ellas con acceso a balcón. - 3 baños completos con cancel de cristal templado. - Área de lavado con ventilación e iluminación natural. - 2 cajones de estacionamiento amplios independientes. - 1 bodega. Se entrega en el 4to trimestre de 2025. Opción a tener un roof privado de 50 m2 por sólo $500, 000 o 60 m2 por $600, 000 extra. Pisos en porcelanato castel, carpintería en chapa de nogal, barras de granito en cocina, mármol y cristal templado en baños. Interesados contactar en día y horario abierto.",223,44600.358744394616,52611.76470588235,1.0,6,False,True,False,False,False,False,False,False,False,False,False,False,False,16.112669053576358
"Av. Baja California 149, Roma, Cuauhtémoc",6565000,Roma,2,2,1,"¡La nueva preventa en la Col. Roma se esta agotando! Compra el tuyo aquí. Te presentamos este departamento único en su clase pues contará con los mejores acabados, estancia perfectamente distribuida, excelentes amenidades y la mejor ubicación. El departamento estará equipado con una cocina de primer nivel, acabados de alta calidad y accesorios de lujo. Además cuentan con carpintería importada y doble vidrio en fachadas para brindarte la máxima tranquilidad. Características: - 67. 56 m² habitables- 2 habitaciones- 2 baños completos- 1 cajón de E- Cocina equipada- ClosétsAmenidades: - Rooftop- Gimnasio- Alberca- Coworking- Área de lectura- Ludoteca- Lounge- Fire pitContáctame y obtén más información acerca de este increíble departamento.",67,97985.07462686567,72589.04109589041,1.0,4,False,False,False,False,True,False,False,False,False,False,False,False,False,15.697263218041947
CALZ. DESIERTO DE LOS LEONES 6060,10550000,San Bartolo Ameyalco,3,3,3,"Departamento en venta, en la colonia San Bartolo Ameyalco Descubre el lujo y la exclusividad en este impresionante departamento situado en el prestigioso Fraccionamiento Bosques 6060. Disfrute de amenidades de primer nivel como un hermoso bosque, ludoteca, alberca, cafetería, gimnasio y salón de eventos todo dentro de un entorno seguro con vigilancia 24 horas. Este espacioso departamento cuenta con 3 recámaras, cada una con su propio baño completo. El área de la sala de tv es perfecta para el entretenimiento familiar. Cuenta con una amplia sala - comedor con salida a una encantadora terraza. La cocina equipada se complementa con un área de lavado y cuarto de servicio. Cuenta con 3 lugares de estacionamiento y una bodega. No te pierdas la oportunidad de vivir en un lugar que combina comodidad, lujo y seguridad.",197,53553.299492385784,50173.010380622836,1.0,6,False,False,False,False,False,False,False,False,False,False,False,False,True,16.171636512673075
La Loma Santa Fe,14500000,Santa Fe La Loma,3,4,3,"Departamento en dos vistas, la loma sta fe. 289m2. 3 Recámaras con walk in closet. Family. 4. 5 baños. Sala comedor. Cocina remodelada. 1 Rec servicio. Lavandería súper amplia. Pisos de madera y mármol. 3 Cajones de estacionamiento. Bodega. Excelentes áreas comunes: dos canchas de pádel, alberca, jardín con cafetería, gimnasio, dos salones de fiestas. ** El pago podrá realizarse con recursos propios o con crédito hipotecario de cualquier institución, pública o privada, sujeto a la negociación que lleguen las partes de la compraventa y a las políticas de la institución correspondiente. ** En las operaciones de crédito el costo total se determinará en función de los montos variables de conceptos de crédito y gastos notariales",289,50173.010380622836,50173.010380622836,1.3333333333333333,7,False,False,False,False,False,False,False,False,False,False,False,False,True,16.489659276356317
Sierra Vertientes,11500000,Lomas de Chapultepec,3,3,3,"Amplio departamento en venta, en una de las mejores colonias de la Ciudad de México, como lo es Lomas de Chapultepec, se encuentra en un séptimo piso, tiene 2 elevadores, consta de 272 m2 en total, 2 recamaras (con posibilidad para una tercera recamara de buen tamaño) 3 baños completos y un medio baño para visitas, sala, comedor, cocina integral equipada, y bodega, cuarto de servicio con baño completo, 3 cajones de estacionamiento, dentro del condominio cuenta con algunas amenidades como, Seguridad 24/7, un gimnasio y un salón de usos multiples.",272,42279.41176470588,75825.49019607843,1.0,6,False,False,False,False,False,False,False,False,False,True,False,False,False,16.257857680289998
Av Paseo de la Reforma 2742,7400000,Lomas de Bezares,2,2,2,"Departamento en Venta en Lomas de Bezares. Descubre este lujoso departamento ubicado en Carretera México-Toluca 2742. Esta propiedad de un solo piso cuenta con 2 recámaras, cada una con su baño completo y vestidor/clóset, además de un family espacioso, lo que la hace muy versátil para familias o parejas. Con acabados y amenidades de lujo, este departamento ofrece comodidad y estilo de vida de alta calidad. + Tipo de operación: Departamento en venta. + Ubicación: Carretera México-Toluca 2742, Lomas de Bezares, Ciudad de México, cdmx. Características relevantes: • Metraje: 185m² • Recámaras: 2 recámaras amplias con vestidor grande. • Baños: 2 baños completos y medio de visitas. • Cocina: Integral amplia. • Sala y comedor: Grandes. • Family/Sala de tv: Grande. • Cuarto de servicio: Con baño. • Área de lavado: Amplia. • Estacionamiento: 2 cajones disponibles. • Vistas: Bonitas al bosque. Normas: • Mascotas: Permitidas. • Fumar: Permitido. Amenidades del residencial premium: • Alberca techada, chapoteadero, camastros y jacuzzi. • Gimnasio completo. • Spa con vapor y zona de masajes. • Jardín grande con juegos de niños. • Zona de asadores. • Salón de eventos amplio con terraza. • Zona de mascotas. • Salón con ping-pong y futbolito. Vialidades: • Av. Constituyentes. • Av Paseo de la Reforma. • Carretera libre Mex-Toluca. • Carretera cuota Mex-Toluca. • Cerca de Santa Fe y de las lomas. Servicios cercanos: Centros comerciales con todos los servicios, Supermercados, Hospitales, Escuelas y universidades, Farmacias, Restaurantes, Cines y otros servicios recreativos, Corporativos cercanos, Bancos, Entre muchos otros servicios. Esperamos su llamada con mucho gusto",185,40000.0,75825.49019607843,1.0,4,False,False,False,False,False,False,False,False,False,True,False,False,False,15.816990693309524
BOSQUE DE TORONJOS,18500000,Bosques de las Lomas,3,3,4,"Tu nuevo hogar te encantará inundado de luz y atractiva vista arbolada, proporcionando un espacio para la relajación total. Precioso el vestíbulo recibe a las invitados donde la barra y la cava puede ser el centro de entretenimiento. Las tres recámaras todas con vestidor y baño alojan serenidad al igual que la tina y vapor de la recámara principal. Con cuatro lugares de estacionamiento techados y dos bodegas disponibles. Agenda tu cita al. - 55Ver datos. - 55Ver datos. Aviso de privacidad, así como quejas, sugerencias y más, contáctanos o visita nuestro sitio web. No incluye el mobiliario mostrado en las fotografías. El precio es más gastos e impuestos de escrituración.",446,41479.82062780269,46257.198443579764,1.0,6,False,False,False,True,False,False,False,False,False,False,False,False,False,16.733281344102608
Lafragua 13,14500000,Tabacalera,1,2,2,"Venta de Hermoso Departamento en Be Grand Reforma Con Vista Panorámica. Cuenta 125m2, Sala comedor, Cocina integral abierta, balcón. 3 recamaras 2 baños, Área de lavado, 2 lugares de estacionamiento, Bodega. Piso alto. El Edificio cuenta con seguridad y Valet parking. Amenidades: Alberca, jacuzzi, gimnasio, spa, business center y salón de fiestas",125,116000.0,72589.04109589041,2.0,3,False,False,False,False,True,False,False,False,False,False,False,False,False,16.489659276356317
Lago Neuchatel 79,16990000,Ampliación Granada,3,2,3,"Este espectacular departamento cuenta con 2 recámaras + estudio + cuarto de servicio completo. Está ubicado en el prestigiado Cuadrante Neuchatel, el desarrollo más solicitado de la zona. Características del departamento: - Metraje total: 207 m² - Área interior: 142. 75 m² - Terraza exterior privada: 64. 29 m² - 2 recámaras + alcoba / estudio. - Cuarto de servicio completo. - 3 estacionamientos, amplios y completamente independientes. - 3 bodegas con 22. 98 m2 totales. Especificaciones: - Recámara principal: walking closet, baño completo y vestidor. - Acabados de lujo. + Mármol Calcatta Altissimo en baño principal. + Mármol Thunder Blue y Star Galaxy en baño principal y secundario. + Cubierta de Cuarzo Silestone tipo cascada, acabado mate. + Lambrines en Melamina española de alta calidad. + Madera de ingeniería alpes. + Porcelanato Italiano de gran formato. La terraza privada es ideal para reuniones al aire libre. Fue diseñada con altos estándares en porcelanatos de gran formato y detalles de iluminación indirecta que crean un ambiente tranquilo y acogedor. Se permite poner una pérgola para aprovechar mejor el espacio, con un comedor exterior, asador y más. (No incluye pérgola) Amenidades de lujo: - Alberca y jacuzzi. - Vapor y sauna. - Gimnasio completamente equipado. - Ludoteca para los más pequeños. - Salón de eventos y bar lounge. - Pet park para consentir a tus mascotas. Ubicación inmejorable: En el exclusivo Cuadrante Neuchatel, rodeado de restaurantes gourmet, tiendas de lujo y centros comerciales. Disfruta de la comodidad de vivir cerca de todo lo que necesitas, sin sacrificar la tranquilidad de una zona residencial. ¡No dejes pasar esta oportunidad única! Contáctanos para más información y agenda tu cita para conocer tu nuevo hogar.",207,82077.29468599033,75825.49019607843,0.6666666666666666,5,False,False,False,False,False,False,False,False,False,True,False,False,False,16.648135552506265
MIER Y PESADO,9260000,Del Valle Norte,3,3,2,"Mier y Pesado es un moderno conjunto de 3 torres con 6 departamentos por piso, algunos con terrazas amplias y/o balcones, Roof Garden privados y comunes, estacionamientos independientes, elevadores y bodegas. El departamento se encuentra en Planta Baja y cuenta con: - 139 m2 habitables más roof privado de 50 m2. - 8 m2 de terraza. - Cocina Integral con amplia barra de granito. - Sala comedor amplia con vista al exterior. - 3 recamaras, la principal con vestidor y baño completo, la secundaria con baño completo y terraza, la tercera con closet. - 3 baños completos con cancel de cristal templado. - Área de lavado con ventilación e iluminación natural. - 2 cajones de estacionamiento independientes. Se entrega en el 4to trimestre de 2025. Pisos en porcelanato castel, carpintería en chapa de nogal, barras de granito en cocina, mármol y cristal templado en baños. Interesados contactar en día y horario abierto.",197,47005.07614213198,52611.76470588235,1.0,6,False,True,False,False,False,False,False,False,False,False,False,False,False,16.041214714613716
COBALTO,16497000,Lomas del Pedregal,4,4,3,"¡Descubre el Pent House más barato por metro en Lomas Pedregal! Conoce este espectacular ph en dos plantas, muy iluminado y excelente distribución, Sala y comedor con techos de doble altura, la cocina cuenta con área de desayunador, bodega, despensa y área de lavado. Además, hay un medio baño para visitas y sala de tv. Encontrarás 3 recámaras, cada una con su baño, y la principal con doble vestidor. En la planta alta, 4ta recamara con baño completo y disfruta de un salón de eventos con barra de bar y puertas corredizas que se integran a una gran terraza de 100m2 con sala exterior comedor y jacuzzi. Estacionamiento para 3 autos. El condominio cuenta con área de juegos, Business center y gimnasio. Además, hay un gran parque central de más de 1000 metros que da a todos los edificios del conjunto. ¡Visítalo y enamórate de tu nuevo hogar!",455,36257.142857142855,40000.0,1.0,8,False,False,False,False,False,False,False,False,False,False,True,False,False,16.61868916477514
"Yukon, DEL Valle Norte",10599000,Del Valle Norte,3,2,2,"Exclusivo y amplio Penthouse con 3 recámaras de gran tamaño, dos baños completos con ventilación natural, y closets espaciosos. La cocina semi-abierta está equipada con una moderna barra de granito, y el área de lavado tiene espacio suficiente para un centro de lavado completo y almacenamiento adicional. La recámara principal destaca por su walk-in closet, baño privado y salida a un balcón con vista verde. Este balcón se extiende desde la habitación principal hasta el área social, ofreciendo un espacio ideal para disfrutar al aire libre y recreativo. El área social es espaciosa, permitiendo la colocación de una sala completa y hasta un comedor de 6 personas, creando un ambiente cómodo y funcional. Además, cuenta con un exclusivo roof garden privado de más de 100 m², al cual se puede acceder tanto desde el interior del departamento como desde el acceso exterior. Este espacio es perfecto para reuniones con amigos y familiares, y cuenta con área de almacenamiento para mobiliario y otros elementos. El Penthouse también incluye dos cajones de estacionamiento de fácil acceso (en fila de dos), seguridad con circuito cerrado, vigilancia las 24 horas, elevador y administración externa. Ademas, destaca por sus grandes vías de comunicación en sus alrededores, y lo céntrico y facil acceso a zonas importantes tanto de la alcaldía como de la cdmx. restricciones*Los renders e imágenes son ilustrativos y de referencia. *No incluye muebles. *Las medidas mencionadas pueden variar ligeramente. *Precio sujeto a cambios sin previo aviso. *El precio no incluye gastos de escrituración, ni los gastos iniciales en caso de comprar con crédito hipotecario, como avalúo y comisión por apertura. *Aviso de privacidad en nuestra pagina web. Ubicación privilegiada, cerca de centros comerciales, restaurantes, escuelas y con acceso rápido a vialidades principales.",230,46082.608695652176,52611.76470588235,0.6666666666666666,5,False,True,False,False,False,False,False,False,False,False,False,False,False,16.17627030935791
"CALLE SALVATIERRA ,",20000000,San Angel Inn,3,1,2,"¡Gran oportunidad de inversión en una de las zonas más exclusivas del sur de la cdmx! Se vende propiedad habitacional con excelente ubicación en Calle Salvatierra 113, Colonia Lomas de San Ángel Inn, Alcaldía Álvaro Obregón, Ciudad de México. Esta propiedad consta de un edificio con tres departamentos, en un terreno de 147. 43 m² y una construcción total de 360 m², ideal para inversionistas o familias grandes que buscan vivir en una zona tranquila y con alta plusvalía. El edificio, de diseño moderno, cuenta con una estructura sólida de hormigón armado, cimientos de mampostería y muros con acabados de mosaico en fachada. En su interior, presenta acabados de yeso, plafones de madera, pisos de mosaico, cocina integral y baños completamente equipados. Cada departamento tiene excelente iluminación natural, ventilación y acceso independiente por escalera continua, además de acceso a una azotea funcional. El inmueble dispone de 3 baños y medio, instalaciones hidráulicas y eléctricas ocultas en perfecto estado, ventanas con cancelería, puertas de tambor, herrería de fierro tabular y vidriería doble especial. También cuenta con un portón eléctrico, brindando mayor seguridad y comodidad. Ubicado en una zona 100% habitacional de nivel socioeconómico medio-alto, rodeado de servicios y vías principales como Periférico y Av. Toluca, con escuelas, parques, iglesias y centros comerciales a menos de 1 km de distancia. Cuenta con todos los servicios urbanos: agua potable, drenaje, electricidad, pavimento, recolección de basura y vigilancia policial. Valor comercial: $21, 000, 000 mxn. Régimen de propiedad: Privada (no en condominio) Una propiedad sin servidumbres legales registradas, con documentación en regla (Escritura No. 92, 651), y con alto potencial tanto para habitar como para generar ingresos por rentas.",346,57803.46820809248,50173.010380622836,0.3333333333333333,4,False,False,False,False,False,False,False,False,False,False,False,False,True,16.811242881518265
VIADUCTO,5485000,Del Valle Norte,3,2,2,"Departamento en 5to nivel exterior. 105m² Habitables. 2 m² Balcón. 3 amplias habitaciones. 2 baños completos. Sala de tv. Estancia amplia e iluminada. Cocina integral con cubierta de granito. Balcón al exterior en habitacion principal. 2 estacionamientos independientes. Roof garden de uno común con asador. Gimnasio. Vigilancia 24 horas. Acabados de alta calidad, porcelanato en suelos, carpintería con gran diseño, espacios amplios, iluminados y ventilados naturalmente. 105m² Habitables. 2m² Balcón. Entrega inmediata. Te gustaría conocer la propiedad?. Interesados contactar en día y horario abierto.",107,51261.68224299065,52611.76470588235,0.6666666666666666,5,False,True,False,False,False,False,False,False,False,False,False,False,False,15.517527834006856
Miguel de Cervantes Saavedra 303,24000000,Ampliación Granada,4,4,3,"Plaza Carso Torre de Super Lujo Vip Muy exclusivo ubicado en Residencial Plaza Carso, inmediato a Polanco, Periférico, Ejercito Nacional, Circuito Interior, Lomas de Chapultepec, los mejores Centros Comerciales y Corporativos, Estilo Contemporáneo amenidades: alberca, gimnasio, salón de eventos, ludoteca, jardin con juegos infantiles y acceso inmediato al centro comercial Plaza Carso. Vigilancia estricta las 24 horas. Cerca de Antara, supermercados, cines, las mejores tiendas y restaurantes. Obra Negra. Excelente zona, céntrica y con acceso a múltiples servicios, comercios, entretenimiento y vías rápidas, acceso controlado. Excelente ubicación inmediato al restaurantes con acceso a múltiples servicios, comercios y lugares públicos, así como a una gran oferta cultural, caminando o en auto. Todos los servicios a la mano. A menos de 10 minutos (caminando): cafés, teatros, cines, club deportivo, farmacias, restaurantes, bancos, gasolinera, spa, salones y peluquerías, regalos, agencias automotrices, etc. Cerca de Corporativos, las mejores escuelas y Universidades. Una de las zonas con mayor plusvalía de la Ciudad de México, segura, y con excelentes opciones para pasear y disfrutar con la familia o amigos",321,74766.35514018692,75825.49019607843,1.0,8,False,False,False,False,False,False,False,False,False,True,False,False,False,16.993564429978885
AUGUSTO RODÍN,5106915,Nápoles,2,2,1,"Augusto Rodin es un proyecto de solo 17 unidades en 5 niveles, todos cuentan con 2 habitaciones y 2 baños completos. El desarrollo cuenta con Roof Garden común y vigilancia, en una zona super conectada y céntrica. Una oportunidad de inversión, a 4 cuadras del parque de la Nápoles. El Departamento cuenta con 89 m2 habitables: - Sala comedor muy amplio con balcón. - Cocina abierto con barra de granito. - 2 recámaras, la principal con vestidor y baño completo. - 2 baños completos con cancel de cristal templado. - Área de lavado con ventilación natural. - Alacena. - 1 cajón de estacionamiento. Amenidades: Vigilancia, Calle arbolada, 1 Lugares de estacionamientos por departamento, Lobby de acceso peatonal y acceso vehicular. Terrazas para o balcón en todas la unidades, Roof Gardens privativos Pent Houses, Roof Garden común, Elevador para 6 personas, Portón vehicular automatizado, Interfón controlado por vigilancia y Estructura de concreto armado. Interesados contactar en día y horario abierto.",89,57381.06741573034,52611.76470588235,1.0,4,False,True,False,False,False,False,False,False,False,False,False,False,False,15.44610625748198
Miguel de Cervantes Saavedra 303,21000000,Ampliación Granada,3,3,3,"Plaza Carso Torre Vip 3 Recamaras con Aire Acondicionado. Muy exclusivo ubicado en Residencial Plaza Carso de Lujo, Torre Cervantes vip, en la calle de Cervantes Saavedra, departamento con excelente orientación, inmediato a Polanco, Periférico, Ejercito Nacional, Circuito Interior, Lomas de Chapultepec, los mejores Centros Comerciales y Corporativos, Estilo Contemporáneo, impecable, precioso departamento, finos acabados de super lujo, en madera, mármol, granito y cerámica, cocina integral con isla central, muy iluminado, amplia área social, 03 recamaras, 03 1/2 baños, 03 estacionamientos, vestidor en la recamara principal y baño con tina, closets empotrados muy amplios, Cuarto de Lavado, Cuarto de Servicio con baño integrado a el departamento, Aire Acondicionado. Amenidades: alberca, gimnasio, salón de eventos, ludoteca, jardines y acceso inmediato al centro comercial Plaza Carso. Vigilancia estricta las 24 horas. Cerca de Antara, supermercados, cines, las mejores tiendas y restaurantes. Excelente zona, céntrica y con acceso a múltiples servicios, comercios, entretenimiento y vías rápidas, acceso controlado. Excelente ubicación inmediato al restaurantes con acceso a múltiples servicios, comercios y lugares públicos, así como a una gran oferta cultural, caminando o en auto. Todos los servicios a la mano. A menos de 10 minutos (caminando): cafés, teatros, cines, club deportivo, farmacias, restaurantes, bancos, gasolinera, spa, salones y peluquerías, regalos, agencias automotrices, etc. Cerca de Corporativos, las mejores escuelas y Universidades. Una de las zonas con mayor plusvalía de la Ciudad de México, segura, y con excelentes opciones para pasear y disfrutar con la familia o amigos.",240,87500.0,75825.49019607843,1.0,6,False,False,False,False,False,False,False,False,False,True,False,False,False,16.860033043306743
AVENIDA SANTA FE,8000000,Contadero,2,2,2,"""Punta Poniente"" es un espectacular desarrollo ubicado en la mejor zona de Santa Fe, con increíbles vistas al parque La Mexicana y a Santa fe. Cuenta con una salida directa al parque de la Mexicana, por la cual puedes sacar a pasear a tus perros de una manera increíble con un elevador aparte. Caracterizado por su exclusividad, diseño y vistas panorámicas donde los atardeceres son un espectáculo diario, este departamento es un lugar único para vivir. Imagina un amplio espacio, con una distribución perfecta, la cual integra todas las áreas, empezando por el amplio recibidor. La estancia es de un concepto abierto lo cual integra perfectamente la sala y el comedor junto con la cocina para convivir mientras preparas algo delicioso. La cocina con barra y espacio de despensa, es ideal para que disfrutes de cocinar y recibir a tus invitados. La recámara principal es un santuario privado, con vestidor y baño completo. Cuentas también área de lavado integrada. En el mismo piso donde están los 2 lugares de estacionamiento, los cuales no se estorban ni entre ellos tienes, además una amplia bodega. El complejo residencial cuenta con estricta seguridad las 24 hrs. , 5 elevadores y estacionamiento de visitas. Además podrás disfrutas de las excelente ameniddes: alberca con vista panorámica, , jacuzzi, spa, gimnasio con vestidores y lockers, salón de fiestas y salón de usos múltiples, terraza muy amplia y ludoteca. Punta Poniente está rodeada de centros comerciales de lujo como el Centro Comercial Santa Fe, restaurantes de alta cocina, así como acceso rápido a importantes vías de comunicación y escuelas de prestigio. Es una zona tranquila y segura, pero con todo lo que uno pueda necesitar al alcance. Que más puedes pedir?. La cita! Llámanos y con gusto programamos una visita para que conozcas en persona este que puede ser tu nuevo hogar. Aviso de privacidad, así como quejas, sugerencias y más, consulta nuestro sitio oficial o contáctanos para más detalle. No incluye el mobiliario mostrado en las fotografías. El precio es más gastos e impuestos de escrituración.",112,71428.57142857143,46257.198443579764,1.0,4,False,False,False,True,False,False,False,False,False,False,False,False,False,15.894952224644102
